"CARM Winery, Portugal",,
"Gianni Gagliardo Winery, Italy",,
"Burmester Winery, Portugal",,
"Cottini Winery, Italy",,
"Lafage Winery, France",,
"Domaine Calvet-Thunevin Winery, France",,
"Château Avernus Winery, France",,
"Heiss Winery, Austria",,
"Monte dall'Ora Winery, Italy",,
"Andresen Winery, Portugal",,
"Rivera Winery, Italy",,
"Skoff Winery, Austria",,
"St. Hubertus Winery, Canada",,
"Borjón Winery, US",,
"Canvasback Winery, US",,
"Château Haut-Monplaisir Winery, France",,
"Domaine du Fief aux Dames Winery, France",,
"Domenico Clerico Winery, Italy",,
"Cantine Paolo Leo Winery, Italy",,
"Cave de Hunawihr Winery, France",,
"Continuum Winery, US",,
"Domaine Eden Winery, US",,
"Esterlin Winery, France",,
"Raccaro Winery, Italy",,
"Lavinea Winery, US",,
"Windrun Winery, US",,
"Sedosa Winery, Spain",,
"La Fleur Ribeyrolles Winery, France",,
"Caves Bonifacio Winery, Portugal",,
"Château Champ du Moulin Winery, France",,
"Château Saint-Florin Winery, France",,
"Cheval Quancard Winery, France",,
"Elephant Seven Winery, US",,
"A. de Luze et Fils Winery, France",,
"Bodkin Winery, US",,
"Altamira Winery, Argentina",,
"Finca La Luz Winery, Argentina",,
"Il Pollenza Winery, Italy",,
"Barros Winery, Portugal",,
"Carr Winery, US",,
"Domaine de Nalys Winery, France",,
"Cantina Zaccagnini Winery, Italy",,
"Château de la Jaubertie Winery, France",,
"Apátsági Winery, Hungary",,
"Bryn Mawr Vineyards, US",,
"Casa Agricola Alexandre Relvas Winery, Portugal",,
"Col dei Venti Winery, Italy",,
"Delgado Winery, US",,
"Dois Irmãos Winery, US",,
"Florian Roblin Winery, France",,
"Heart Catcher Winery, US",,
"Tenuta Santo Pietro Winery, Italy",,
"Weingut Stadt Lahr Winery, Germany",,
"Windsor Oaks Winery, US",,
"Château les Reuilles Winery, France",,
"Domaine de la Prébende Winery, France",,
"Vincent Lataste Winery, France",,
"Marcato Winery, Italy",,
"Il Molino di Grace Winery, Italy",,
"Iris Vineyards, US",,
"Joseph Soggé Winery, US",,
"La Castellina Winery, Italy",,
"Merlot-Tannat Winery, France",,
"Trig Point Winery, US",,
"Tyler Florence Winery, US",,
"R. Stuart & Co. Winery, US",,
"L'Oliveto Winery, US",,
"Martha's Wines, Portugal",,
"Palmer & Co Winery, France",,
"Rocca di Castagnoli Winery, Italy",,
"Silver Mountain Winery, US",,
"Alchemist Winery, US",,
"Maison Basque Winery, US",,
"Saxenburg Estate Winery, South Africa",,
"Buffalo Ridge Winery, US",,
"Michel Lynch Winery, France",,
"White Blend Winery, France",,
"Mont Tauch Winery, France",,
"Dolce Winery, US",,
"Almaviva Winery, Chile",,
"Seña Winery, Chile",,
"Chalone Vineyard, US",,
"Crocedimezzo Winery, Italy",,
"Domaine Maestracci Winery, France",,
"Gimenez Mendez Winery, Uruguay",,
"Tbilvino Winery, Georgia",,
"Anew Winery, US",,
"Bolla Winery, Italy",,
"Tom Gore Winery, US",,
"Yves Leccia Winery, France",,
"786 Wines, US",,
"Black Cottage Winery, New Zealand",,
"Borrellie Winery, US",,
"Irwin Family Vineyards, US",,
"Domaine de Vaugondy Winery, France",,
"Etienne Boileau Winery, France",,
"Cloudlift Cellars Winery, US",,
"Clos d'Audhuy Winery, France",,
"Co Dinn Winery, US",,
"Domaine Guy & Yan Dufouleur Winery, France",,
"Donatella Cinelli Colombini Winery, Italy",,
"K Cellars Winery, Bulgaria",,
"Kössler Winery, Italy",,
"La Mannella Winery, Italy",,
"Le Mandolare Winery, Italy",,
"Orbelus Winery, ",,
"Schloss Saarstein Winery, Germany",,
"Thomas Schmitt Winery, Germany",,
"Otero Ramos Winery, Argentina",,
"Tirapelle Nicola Winery, Italy",,
"Vitevis Winery, Italy",,
"San Juan Vineyards, US",,
"Vila Winery, Argentina",,
"Bodegas Escorihuela Winery, Argentina",,
"Fanucchi Winery, US",,
"Chateau Morrisette Winery, US",,
"Yellow Hawk Cellar Winery, US",,
"Campo Eliseo Winery, Spain",,
"Cepa 21 Winery, Spain",,
"Domaine Chanson Winery, France",,
"Domaine Rossignol-Trapet Winery, France",,
"Nicolas Gaudry Winery, France",,
"Scroll Winery, US",,
"Silvano Bolmida Winery, Italy",,
"Stefania Mezzetti Winery, Italy",,
"Tenute dei Vallarino Winery, Italy",,
"Fontana Winery, Italy",,
"French Creek Winery, US",,
"Giannoni Fabbri Winery, Italy",,
"Musso Winery, Italy",,
"Musset-Roullier Winery, France",,
"Torraccia del Piantavigna Winery, Italy",,
"Horse & Plow Winery, US",,
"Cormòns Winery, Italy",,
"Domaine de Jarras Winery, France",,
"Domaine Grosbois Winery, France",,
"El Pensador Winery, Spain",,
"Harmonique Winery, US",,
"Helwig Winery, US",,
"Herdade dos Coelheiros Winery, Portugal",,
"Jacob Williams Winery, US",,
"Kramer Winery, US",,
"Barão de Vilar Winery, Portugal",,
"Domaine de Bellecours Winery, France",,
"Apsara Winery, US",,
"Arínzano Winery, Spain",,
"Bertrand-Delespierre Winery, France",,
"Castel Boglione Winery, Italy",,
"Castello Bonomi Winery, Italy",,
"Chassenay d'Arce Winery, France",,
"Château du Seguinier Winery, France",,
"Château Jean Faux Winery, France",,
"Château Jussas Winery, France",,
"Château la Freynelle Winery, France",,
"Château Labatut Winery, France",,
"Château Les Martins Winery, France",,
"Château Rocher Bellevue Winery, France",,
"Mollie Winery, US",,
"Nittnaus Anita und Hans Winery, Austria",,
"Heribert Bayer Winery, Austria",,
"Weszeli Winery, Austria",,
"Franz Hirtzberger Winery, Austria",,
"Anko Winery, Argentina",,
"Bodegas Tintoralba Winery, Spain",,
"Skinnygirl Winery, US",,
"Château de Ricaud Winery, France",,
"Château le Noble Winery, France",,
"Château Les Gravières de la Brandille Winery, France",,
"Seven Daughters Winery, US",,
"Mil Piedras Winery, Argentina",,
"Raimat Winery, Spain",,
"The Loyal Companion Winery, US",,
"Château de Lavagnac Winery, France",,
"Insatiable Winery, US",,
"Espectacle Winery, Spain",,
"Barons V Winery, US",,
"Cantina di Venosa Winery, Italy",,
"Castillo Labastida Winery, Spain",,
"Celler Arché Pagès Winery, Spain",,
"Château Bel Air Perponcher Winery, France",,
"Château Clos de Sarpe Winery, France",,
"Château du Domaine de l'Eglise Winery, France",,
"Château Fombrauge Winery, France",,
"Château Fonsèche Winery, France",,
"Château Joinin Winery, France",,
"Château La Maroutine Winery, France",,
"Château Malbec Winery, France",,
"Château Mongravey Winery, France",,
"Château Reverdi Winery, France",,
"Donnachiara Winery, Italy",,
"Château Bois Malot Winery, France",,
"Château de Rayne Vigneau Winery, France",,
"Dobbes Family Estate Winery, US",,
"Fortress Winery, US",,
"Garage Wine Co. Winery, Chile",,
"Jaxon Winery, US",,
"Lawer Winery, US",,
"Little Giant Winery, US",,
"M2 Winery, US",,
"Phillips Hill Winery, US",,
"Vizar Winery, Spain",,
"Bernard Magrez Winery, Spain",,
"Carden Winery, US",,
"Castello del Terriccio Winery, Italy",,
"Château Saint Esteve d'Uchaux Winery, France",,
"Chêne Bleu Winery, France",,
"Cutruzzola Winery, US",,
"Goat Bubbles Winery, US",,
"Viña Olabarri Winery, Spain",,
"Ballard Lane Winery, US",,
"BonAnno Winery, US",,
"Cà del Vispo Winery, Italy",,
"db Winery, US",,
"Domaine A. Machard de Gramont Winery, France",,
"Domaine Champy Winery, France",,
"Domaine Charly Nicolle Winery, France",,
"Fattoria Mantellassi Winery, Italy",,
"Dog Point Winery, New Zealand",,
"Weibel Family Winery, US",,
"Mission Estate Winery, New Zealand",,
"Rampa di Fugnano Winery, Italy",,
"Morovino Winery, US",,
"Motta Winery, Italy",,
"Poggiotondo Winery, Italy",,
"Viña Tabalí Winery, Chile",,
"Domaine Thomas & Fils Winery, France",,
"Bennett Lane Winery, US",,
"Casa Cadaval Winery, Portugal",,
"Cullen Winery, Australia",,
"Enrique Mendoza Winery, Spain",,
"Ermisch Winery, US",,
"Fig Winery, US",,
"Francesc Sanchez Bas Winery, Spain",,
"Madorom Winery, US",,
"Domaine des Rochelles Winery, France",,
"Costaruél Winery, Italy",,
"Dal Din Winery, Italy",,
"Municipal Winemakers Winery, US",,
"DeWaal Winery, South Africa",,
"Fattoria di Basciano Winery, Italy",,
"Simple Math Cellars Winery, US",,
"Viniterra Winery, Argentina",,
"Poderi Aldo Conterno Winery, Italy",,
"Luigi Baudana Winery, Italy",,
"Murray Street Winery, Australia",,
"JCR Winery, US",,
"N. Kendall Wines, US",,
"Prodigal Winery, US",,
"Signal Ridge Winery, US",,
"Amor Fati Winery, US",,
"Casa Smith Winery, US",,
"Clunia Winery, Spain",,
"Domaine de Roche-Guillon Winery, France",,
"Domaine Rossignol-Février Père et Fils Winery, France",,
"Vetrère Winery, Italy",,
"Hacienda La Lomita Winery, Mexico",,
"Tenuta Villa Tavernago Winery, Italy",,
"Cantine Ceci Winery, Italy",,
"CK Mondavi Winery, US",,
"Loken Cellars Winery, US",,
"Philip Carter Winery, US",,
"Bodega El Transito Winery, Argentina",,
"Cà Montanari Winery, Italy",,
"Canti Winery, Italy",,
"Prima Mazzo Winery, Italy",,
"Spellbound Winery, US",,
"Signano Winery, Italy",,
"Terra Silvestre Winery, Portugal",,
"Vins Descombe Winery, France",,
"A Blooming Hill Vineyard, US",,
"Casa de Cambres Winery, Portugal",,
"Director's Cut Winery, US",,
"Schwarz Wine Company Winery, Australia",,
"Bernard et Christophe Richel Winery, France",,
"Vellum Winery, US",,
"Cremaschi Furlotti Winery, Chile",,
"Furthermore Winery, US",,
"Harney Lane Winery, US",,
"Forget-Brimont Winery, France",,
"Manzone Winery, Italy",,
"Narrow Gate Winery, US",,
"Nico Winery, US",,
"Russo Winery, Italy",,
"Saini Winery, US",,
"Six Sigma Ranch Winery, US",,
"Ten Acre Winery, US",,
"Amelle Winery, US",,
"Blue Plate Winery, US",,
"Santa Isle Winery, Chile",,
"Sélection Laurence Féraud Winery, France",,
"Tenuta La Badiola Winery, Italy",,
"Comoloco Winery, Spain",,
"Domaine du Moulin Winery, France",,
"Frieden-Berg Winery, Germany",,
"Vignerons de Buzet Winery, France",,
"Marques de Tomares Winery, Spain",,
"Prieuré de Montézargues Winery, France",,
"Parés Baltà Winery, Spain",,
"Laudun Chusclan Winery, France",,
"Michel Picard Winery, France",,
"Rippey Winery, US",,
"Vasco Urbano Winery, US",,
"Lusovini Winery, Portugal",,
"Sepp Moser Winery, Austria",,
"Stellina Winery, US",,
"Altaïr Winery, Chile",,
"Baron Knyphausen Winery, Germany",,
"Weingut Niklas Winery, Italy",,
"Zuani Winery, Italy",,
"SassodiSole Winery, Italy",,
"Tenuta Il Poggione Winery, Italy",,
"Thistle Winery, US",,
"Kendric Winery, US",,
"Marqués de Campo Nuble Winery, Spain",,
"Montecastro Winery, Spain",,
"Innocenti Winery, Italy",,
"La Colombina Winery, Italy",,
"Neo Winery, Spain",,
"Patit Creek Cellars Winery, US",,
"Robert Pepi Winery, US",,
"Pinot Noir Winery, US",,
"Woollaston Winery, New Zealand",,
"Vaeni Winery, Greece",,
"Peacock Cellars Winery, US",,
"R8 Winery, US",,
"L'Oca Ciuca Winery, Italy",,
"Relic Winery, US",,
"Skouras Winery, Greece",,
"Fonterenza Winery, Italy",,
"Herdade dos Templários Winery, Portugal",,
"Martinborough Vineyard, New Zealand",,
"Toretti's Winery, US",,
"Tselepos Winery, Greece",,
"Il Fitto Winery, Italy",,
"Joel Gott Winery, US",,
"Marcarini Winery, Italy",,
"Mirus Winery, Italy",,
"Neethlingshof Winery, South Africa",,
"Newhouse Family Winery, US",,
"Caricature Winery, US",,
"Chandler Reach Winery, US",,
"Château de Farel Winery, France",,
"Château Petit-Freylon Winery, France",,
"Château Pierrousselle Winery, France",,
"Château Puy Mouton Winery, France",,
"Raeburn Winery, US",,
"Reign Winery, US",,
"Robert Ramsay Winery, US",,
"Smith & Hook Winery, US",,
"Boschendal Winery, South Africa",,
"Vortex Winery, US",,
"Wind Rose Winery, US",,
"Gremillet Winery, France",,
"Conterno Fantino Winery, Italy",,
"Ded.Reckoning Winery, US",,
"Protea Winery, South Africa",,
"Amalia Winery, Italy",,
"Avelina Winery, US",,
"Blacksmith Winery, US",,
"C.G. di Arie Winery, US",,
"Cantina Caorsa Winery, Italy",,
"Casa de la Cruz Winery, US",,
"CC Winery, US",,
"Zonte's Footstep Winery, Australia",,
"Mähler-Besse Winery, France",,
"Medrano Winery, Argentina",,
"Red Knot Winery, Australia",,
"Maggio Vini Winery, Italy",,
"The Crusher Winery, US",,
"Vazart Coquart & Fils Winery, France",,
"Voyager Estate Winery, Australia",,
"Enos Vineyard, US",,
"Expression 38 Winery, US",,
"Tenuta Monte Gorna Winery, Italy",,
"Di Arie Winery, US",,
"Domaine des Tilleuls Winery, France",,
"Domaine Fouassier Winery, France",,
"Domaine Vacheron Winery, France",,
"Lornano Winery, Italy",,
"Losi Querciavalle Winery, Italy",,
"Westwood Winery, US",,
"Remelluri Winery, Spain",,
"Donna Olga Winery, Italy",,
"Bodega Margot Winery, Argentina",,
"Bodegas Ontañón Winery, Spain",,
"Château de Fontenille Winery, France",,
"Château du Taillan Winery, France",,
"Château Roc de Ségur Winery, France",,
"Kirkland Signature Winery, France",,
"A-Mano Winery, Italy",,
"Bodegas El Porvenir De Los Andes Winery, Argentina",,
"Château le Moulin de la Jaumarde Winery, France",,
"Château l'Escart Winery, France",,
"Olsen Estates Winery, US",,
"Château Trottevieille Winery, France",,
"Principe Corsini Fattoria Le Corti Winery, Italy",,
"Herdade da Comporta Winery, Portugal",,
"Casal do Conde Winery, Portugal",,
"Elkhorn Ridge Winery, US",,
"Félix Rocha Winery, Portugal",,
"Finca Nueva Winery, Spain",,
"Vignobles Sarrail Winery, France",,
"Xavier Flouret Winery, Chile",,
"O'Brien Winery, US",,
"Peterson Winery, US",,
"Scharffenberger Winery, US",,
"Cesari Winery, Italy",,
"De Venoge Winery, France",,
"Charles Heidsieck Winery, France",,
"Remo Farina Winery, Italy",,
"Delamotte Winery, France",,
"Girolamo Russo Winery, Italy",,
"Agrapart & Fils Winery, France",,
"Philipponnat Winery, France",,
"Tenuta Santa Maria alla Pieve Winery, Italy",,
"Toquade Winery, US",,
"Bodegas Corral Winery, Spain",,
"Yates Family Vineyard, US",,
"Francone Winery, Italy",,
"Gitton Père et Fils Winery, France",,
"Lusso Della Terra Winery, US",,
"Keswick Vineyards, US",,
"Narmada Winery, US",,
"Federico Paternina Winery, Spain",,
"Hawkstone Winery, US",,
"Andrew Murray Winery, US",,
"Butterfield Station Winery, US",,
"Camboral Winery, Spain",,
"Rock Wren Winery, US",,
"Hoyt Family Vineyards, US",,
"Scrapbook Winery, US",,
"Michael Florentino Winery, US",,
"Arrow Creek Winery, US",,
"Bodegas Escudero Winery, Spain",,
"Ramspeck Winery, US",,
"Sada Winery, Italy",,
"Shadowbox Winery, US",,
"Momo Winery, New Zealand",,
"Upland Estates Winery, US",,
"Zynthesis Winery, US",,
"Montezuma Winery, US",,
"Nice Pairing Winery, US",,
"Poggio alle Querce Winery, Italy",,
"Alderbrook Winery, US",,
"Jorian Hill Winery, US",,
"Quasar Winery, Spain",,
"SJ Montigny Winery, Germany",,
"Tenuta Roveglia Winery, Italy",,
"Timothy Malone Winery, US",,
"C R Graybehl Winery, US",,
"Château Toutigeac Winery, France",,
"Domaine G. Metz Winery, France",,
"Draxton Winery, US",,
"Mike and Molly Hendry Winery, US",,
"Mission Hill Winery, Canada",,
"Padelletti Winery, Italy",,
"Rarecat Winery, US",,
"Robert John Winery, US",,
"SoDo Winery, US",,
"Love That Red Winery, US",,
"Terra Bella Winery, US",,
"Campogiovanni Winery, Italy",,
"Contino Winery, Spain",,
"Denis Jamain Winery, France",,
"Domaine Philippe Raimbault Winery, France",,
"Domaine Trouillet Winery, France",,
"Domaine Vincent Pinard Winery, France",,
"Emile Balland Winery, France",,
"Empire Estate Winery, US",,
"Francis Blanchet Winery, France",,
"Zepaltas Winery, US",,
"Brooklyn Winery, US",,
"Casa Sola Winery, Italy",,
"Q Winery, US",,
"Terra Romana Winery, Romania",,
"Château Sansey Winery, France",,
"Hans Fahden Winery, US",,
"Château d'Arcins Winery, France",,
"Punk Dog Winery, US",,
"Tenuta Santavenere Winery, Italy",,
"Tessier Winery, US",,
"Timothy Moore Winery, US",,
"Winenot Winery, France",,
"Bailli de Provence Winery, France",,
"Castellaccia Winery, Italy",,
"Château la Tour de l'Evêque Winery, France",,
"Domaine Jacourette Winery, France",,
"Estandon Winery, France",,
"Excelsior Winery, South Africa",,
"Weather Winery, US",,
"Paddy Borthwick Winery, New Zealand",,
"Richmond Plains Winery, New Zealand",,
"Varner Winery, US",,
"Schweiger Winery, US",,
"Alban Winery, US",,
"Château Faugères Winery, France",,
"Château Langoa Barton Winery, France",,
"Giaconda Winery, Australia",,
"Château Labégorce Margaux Winery, France",,
"Château Monbrison Winery, France",,
"Château Brane-Cantenac Winery, France",,
"Steele Winery, US",,
"Henry of Pelham Winery, Canada",,
"Lake Sonoma Winery, US",,
"Villa Mt. Eden Winery, US",,
"Storybook Mountain Winery, US",,
"Neil Ellis Winery, South Africa",,
"Colio Winery, Canada",,
"Waterford Winery, South Africa",,
"Meander Winery, US",,
"Gianfranco Alessandria Winery, Italy",,
"Honig Winery, US",,
"Krug Winery, France",,
"Bruno Rocca Winery, Italy",,
"Luigi Pira Winery, Italy",,
"Orlando Abrigo Winery, Italy",,
"Château le Bonnat Winery, France",,
"Dourthe Winery, France",,
"Josmeyer Winery, France",,
"Kason Winery, US",,
"M. Autumn Winery, US",,
"Château la Martinette Winery, France",,
"Château Pas du Cerf Winery, France",,
"Château Thuerry Winery, France",,
"Cupcake Winery, New Zealand",,
"Selvanova Winery, Italy",,
"Tre Anelli Winery, US",,
"Domaine de Savagny Winery, France",,
"Château Haut Peyrefaure Winery, France",,
"Château la Favière Winery, France",,
"City Winery Chicago Winery, US",,
"Claro Winery, Chile",,
"Alliance Loire Winery, France",,
"Red Blend Winery, US",,
"Cave des Producteurs de Vouvray Winery, France",,
"Château Bel Air la Royère Winery, France",,
"Château Bréhat Winery, France",,
"Château Camarsac Winery, France",,
"Rutherford Grove Winery, US",,
"Sierra Norte Winery, Spain",,
"Vignoble de la Jarnoterie Winery, France",,
"Baron Herzog Winery, US",,
"Chartron et Trébuchet Winery, France",,
"Villa Canestrari Winery, Italy",,
"Cantina Valle Isarco Winery, Italy",,
"Sandro de Bruno Winery, Italy",,
"Stonehaven Winery, Australia",,
"Valter Sirk Winery, Slovenia",,
"Bastianich Winery, Croatia",,
"Bella Piazza Winery, US",,
"Champagne Gremillet Winery, France",,
"Chatom Vineyards, US",,
"Domaine de la Perruche Winery, France",,
"Faust Winery, US",,
"Hecht & Bannier Winery, France",,
"Henri Goutorbe Winery, France",,
"Li Veli Winery, Italy",,
"Lucania Winery, Italy",,
"Marco Negri Winery, Italy",,
"Murfatlar Winery, Romania",,
"Page Springs Winery, US",,
"Principessa Gavia Winery, Italy",,
"Sandrone Winery, Italy",,
"Shaw Winery, US",,
"Cornarea Winery, Italy",,
"Dessilani Winery, Italy",,
"Finca El Portillo Winery, Argentina",,
"Jalama Winery, US",,
"Romana Carlo Winery, Italy",,
"Barra Winery, US",,
"Bodega Goulart Winery, Argentina",,
"Five Rows Winery, US",,
"Garriotin Winery, France",,
"Tin Roof Winery, US",,
"Teanum Winery, Italy",,
"Jeff Gordon Winery, US",,
"Rock Stream Winery, US",,
"Tierra Caliente Winery, US",,
"Hamilton Winery, US",,
"Brugnano Winery, Italy",,
"Ambition Winery, US",,
"Blue Teal Winery, US",,
"Bodegas Adriá Winery, Spain",,
"Mendoza Vineyards, Argentina",,
"Montefiore Winery, Israel",,
"Kenefick Ranch Winery, US",,
"Valenti Winery, Italy",,
"Autoritas Winery, Chile",,
"Masseria del Feudo Winery, Italy",,
"Tucannon Winery, US",,
"VIgnobles Roux Winery, France",,
"The Crater Rim Winery, New Zealand",,
"Leyendas de Familia Winery, Chile",,
"South Coast Winery, US",,
"Alliata Winery, Italy",,
"Château Clauzet Winery, France",,
"Vionta Winery, Spain",,
"Wrongo Dongo Winery, Spain",,
"Prà Winery, Italy",,
"Windward Vineyard, US",,
"Emina Winery, Spain",,
"Fattoria Zerbina Winery, Italy",,
"Fox Meadow Winery, US",,
"Château Bellegrave Winery, France",,
"Château Franc Mayne Winery, France",,
"Le Petit Mouton de Mouton-Rothschild Winery, France",,
"Astrale e Terra Winery, US",,
"Enon Winery, South Africa",,
"Wilson Winery, US",,
"Jermann Winery, Italy",,
"Lafond Winery, US",,
"Markus Altenburger Winery, Austria",,
"Mathilde Chapoutier Sélection Winery, France",,
"Native Flora Winery, US",,
"Netzl Winery, Austria",,
"Palliser Estate Winery, New Zealand",,
"Domaine Souviou Winery, France",,
"Grand Napa Winery, US",,
"Mansion Creek Winery, US",,
"Château Lacave Winery, Brazil",,
"Castillo Viejo Winery, Uruguay",,
"Healdsburg Ranches Winery, US",,
"Stone Edge Farm Winery, US",,
"Le Chateau Winery, US",,
"Carmenet Winery, US",,
"Mark West Winery, US",,
"Domaine Vaquer Winery, France",,
"Villa Oneiro Winery, US",,
"Broadside Winery, US",,
"Cantina Santa Maddalena Winery, Italy",,
"Castel Sallegg Winery, Italy",,
"Celler Piñol Winery, Spain",,
"Mas Igneus Winery, Spain",,
"Malavasi Daniele Winery, Italy",,
"Masut da Rive Winery, Italy",,
"O. Fournier Winery, Chile",,
"Page Mill Winery, US",,
"Pinhal da Torre Winery, Portugal",,
"Woop Woop Winery, Australia",,
"CalNaturale Winery, US",,
"Viña Los Boldos Winery, Chile",,
"Les Jamelles Winery, France",,
"Bodegas Los Llanos Winery, Spain",,
"Vinhos Norte Winery, Portugal",,
"Giorgio Meletti Cavallari Winery, Italy",,
"Church Road Winery, New Zealand",,
"D & R Dubois Winery, France",,
"Edge Winery, US",,
"Kawarau Estate Winery, New Zealand",,
"Solabal Winery, Spain",,
"Te Kairanga Winery, New Zealand",,
"Lawson's Dry Hills Winery, New Zealand",,
"Montenisa Winery, Italy",,
"Morris Ranch Winery, US",,
"Brandborg Winery, US",,
"Château Anthonic Winery, France",,
"Château Coufran Winery, France",,
"Carhartt Vineyard, US",,
"Starfield Winery, US",,
"Te Whare Ra Winery, New Zealand",,
"Château Rimauresq Winery, France",,
"Coral Wines, US",,
"Castello di Monterinaldi Winery, Italy",,
"Castello di Radda Winery, Italy",,
"Quinta de Soalheiro Winery, Portugal",,
"San Leonino Winery, Italy",,
"Setriolo Winery, Italy",,
"Dachshund Winery, US",,
"Borgo Salcetino Winery, Italy",,
"Castello di Fonterutoli Winery, Italy",,
"Château de Chambert Winery, France",,
"Wiese & Krohn Winery, Portugal",,
"J. H. Andresen Winery, Portugal",,
"Crinella Winery, US",,
"Leconfield Winery, Australia",,
"Cali 351 Winery, US",,
"Johann Haart Winery, Germany",,
"Sonoma Coast Vineyards, US",,
"Paul Cluver Winery, South Africa",,
"Garnier et Fils Winery, France",,
"Isabel Mondavi Winery, US",,
"JR Wine Winery, US",,
"Felton Road Winery, New Zealand",,
"Domaine Emmanuel Giboulot Winery, France",,
"Château Angélus Winery, France",,
"Château la Gaffelière Winery, France",,
"Château Rol Valentin Winery, France",,
"Château Grand Mayne Winery, France",,
"Château La Bon Pasteur Winery, France",,
"Château Quintus Winery, France",,
"Château Berliquet Winery, France",,
"Château Clinet Winery, France",,
"Quinta da Prelada Winery, Portugal",,
"Domaine Thunevin-Calvet Winery, France",,
"Mazzi Winery, Italy",,
"Pahlmeyer Winery, US",,
"The Vineyard House Winery, US",,
"Boeschen Vineyards, US",,
"Golden Triangle Winery, US",,
"Two Sisters Winery, US",,
"l'Escargot Winery, France",,
"Muscardini Winery, US",,
"Palaia Vineyards, US",,
"Pomelo Winery, US",,
"Winery by the Creek Winery, US",,
"Worthy Winery, US",,
"Aitor Ider Balbo Winery, Argentina",,
"Casa Rondeña Winery, US",,
"Merlot Winery, US",,
"Unionville Winery, US",,
"Hat in the Ring Winery, Argentina",,
"Dos Cabezas Winery, US",,
"Naches Heights Winery, US",,
"Tahoe Ridge Winery, US",,
"Two Wives Winery, US",,
"Jana Winery, US",,
"Pianetta Winery, US",,
"Enate Winery, Spain",,
"EnRoute Winery, US",,
"Ernie Els Winery, South Africa",,
"Franchere Winery, US",,
"Hansen-Lauer Winery, Germany",,
"Nautilus Winery, New Zealand",,
"Henry Marionnet Winery, France",,
"Bachelder Winery, Canada",,
"Martin Woods Winery, US",,
"Mongarda Winery, Italy",,
"Berberana Winery, Spain",,
"Catania Winery, Spain",,
"Block Nine Winery, US",,
"Château Beaubois Winery, France",,
"Helderberg Wijnmakerij Winery, South Africa",,
"L de Lyeth Winery, US",,
"Tacama Winery, Peru",,
"Valdubón Winery, Spain",,
"Laurent-Perrier Winery, France",,
"Martin Estate Winery, US",,
"Matteo Correggia Winery, Italy",,
"Davenport Cellars Winery, US",,
"Prunotto Winery, Italy",,
"Antica Casa Vinicola Scarpa Winery, Italy",,
"Cave Cooperative du Vendômois Winery, France",,
"Baricci Winery, Italy",,
"Ambassador Vineyard, US",,
"Les Maîtres Vignerons de Saint-Louis Winery, France",,
"10 Knots Winery, US",,
"Doon Buggy Winery, US",,
"Daniel Gehrs Winery, US",,
"Galvan Winery, US",,
"Villa Monteleone Winery, Italy",,
"Fattoria della Talosa Winery, Italy",,
"Romeo Winery, Italy",,
"Tenuta Valdipiatta Winery, Italy",,
"Two Ponds Winery, US",,
"Woodbury Winery, US",,
"La Chouette Winery, US",,
"Tenuta Fernanda Cappello Winery, Italy",,
"Grandes Vinos y Viñedos Winery, Spain",,
"Garbó Winery, Spain",,
"Casa Valduga Winery, Brazil",,
"Lockwood Winery, US",,
"Dunstan Winery, US",,
"Discoveries Winery, US",,
"Five Rivers Winery, US",,
"Calendar Girl Winery, US",,
"Gecko Winery, US",,
"1848 Winery, Israel",,
"Mill Creek Winery, US",,
"Primus Winery, Chile",,
"Redd Brand Winery, US",,
"Careglio Winery, Italy",,
"Château de Nardon Winery, France",,
"Stadt Krems Winery, Austria",,
"Thierry-Weber Winery, Austria",,
"Tulpen Winery, US",,
"Château le Piat Winery, France",,
"Channing Daughters Winery, US",,
"Fattoria Poggerino Winery, Italy",,
"Fattoria di Corsignano Winery, Italy",,
"Tenuta San Vito Winery, Italy",,
"Wohlmuth Winery, Austria",,
"Guado al Melo Winery, Italy",,
"Jack Winery, US",,
"Joyce Winery, US",,
"Monte Ferro Winery, US",,
"Nera Winery, Italy",,
"Straight Line Winery, US",,
"Tenuta dei Pianali Winery, Italy",,
"Château la Bretonnière Winery, France",,
"Amaboko Winery, South Africa",,
"Asensio Winery, Spain",,
"Poggio al Casone Winery, Italy",,
"Conde de Siruela Winery, Spain",,
"Storrs Winery, US",,
"Château d'Azur Winery, France",,
"Domaine Fourrey Winery, France",,
