"CARM Winery, Portugal",,
"Caricature Winery, US","1525 E Jahant Rd, Acampo, CA 95220, USA","[38.204161, -121.296572]"
"Château Pierrousselle Winery, France","LD La Garrigue, 24240 Saussignac, France","[44.80656399999999, 0.328731]"
"Château Puy Mouton Winery, France",France,"[46.227638, 2.213749]"
"Vortex Winery, US",,
"Ded.Reckoning Winery, US",,
"Casa de la Cruz Winery, US","5875 Lakeville Hwy, Petaluma, CA 94954, USA","[38.2010248, -122.5339508]"
"Expression 38 Winery, US",,
"Di Arie Winery, US","5200 Di Arie Road, Mt Aukum, CA 95656, USA","[38.5677767, -120.7721245]"
"Donna Olga Winery, Italy",Italy,"[41.87194, 12.56738]"
"Kirkland Signature Winery, France","Route de Courthézon, 84230 Châteauneuf-du-Pape, France","[44.067734, 4.8499934]"
"Finca Nueva Winery, Spain",Spain,"[40.46366700000001, -3.74922]"
"Xavier Flouret Winery, Chile",Chile,"[-35.675147, -71.542969]"
"Remo Farina Winery, Italy","202 N Houston St, Granbury, TX 76048, USA","[32.443335, -97.787711]"
"Toquade Winery, US",,
"Camboral Winery, Spain",Spain,"[40.46366700000001, -3.74922]"
"Ramspeck Winery, US",,
"Shadowbox Winery, US",,
"Zynthesis Winery, US","9119 Graton Rd, Graton, CA 95444, USA","[38.4357927, -122.8701654]"
"Jorian Hill Winery, US",,
"Quasar Winery, Spain",Spain,"[40.46366700000001, -3.74922]"
"Zepaltas Winery, US",United States,"[37.09024, -95.712891]"
"Château Sansey Winery, France",France,"[46.227638, 2.213749]"
"Tessier Winery, US",,
"Château Langoa Barton Winery, France","33250 Saint-Julien-Beychevelle, France","[45.1573848, -0.7392487999999999]"
"Château Monbrison Winery, France","33460 Margaux, France","[45.04443, -0.6687565999999999]"
"Villa Mt. Eden Winery, US","22020 Mt Eden Rd, Saratoga, CA 95070, USA","[37.26506, -122.079687]"
"Champagne Gremillet Winery, France","1 Rue Envers de Valeine, 10110 Balnot-sur-Laignes, France","[48.02493570000001, 4.3609405]"
"Marco Negri Winery, Italy",Italy,"[41.87194, 12.56738]"
"Dessilani Winery, Italy",Italy,"[41.87194, 12.56738]"
"Garriotin Winery, France",France,"[46.227638, 2.213749]"
"Tierra Caliente Winery, US","Mission St & 5th Ave, Carmel-By-The-Sea, CA 93921, United States","[36.5566571, -121.920859]"
"Autoritas Winery, Chile",Chile,"[-35.675147, -71.542969]"
"The Crater Rim Winery, New Zealand",New Zealand,"[-40.900557, 174.885971]"
"Leyendas de Familia Winery, Chile",Chile,"[-35.675147, -71.542969]"
"Le Petit Mouton de Mouton-Rothschild Winery, France","Château Mouton Rothschild, 33250 Pauillac, France","[45.2130751, -0.7698524]"
"Mathilde Chapoutier Sélection Winery, France",France,"[46.227638, 2.213749]"
"Villa Oneiro Winery, US",,
"Broadside Winery, US",,
"Woop Woop Winery, Australia",Australia,"[-25.274398, 133.775136]"
"Kawarau Estate Winery, New Zealand","198 Church Rd, Poraiti, Napier 4112, New Zealand","[-39.5184741, 176.8448458]"
"Château de Chambert Winery, France","Château de Chambert, Les Hauts Coteaux, 46700 Floressas, France","[44.4484575, 1.1320716]"
"J. H. Andresen Winery, Portugal","R. Felizardo de Lima 74, 4400-140 Vila Nova de Gaia, Portugal","[41.1282376, -8.6208061]"
"Johann Haart Winery, Germany","Ausoniusufer 18, 54498 Piesport, Germany","[49.8858, 6.91276]"
"Domaine Thunevin-Calvet Winery, France","Avenue Jean Jaurès, 66460 Maury, France","[42.809936, 2.600715]"
"Hat in the Ring Winery, Argentina",Argentina,"[-38.416097, -63.61667199999999]"
"Two Wives Winery, US","6808 US-24, Huntington, IN 46750, USA","[40.9295346, -85.38658029999999]"
"Catania Winery, Spain",Spain,"[40.46366700000001, -3.74922]"
"L de Lyeth Winery, US",United States,"[37.09024, -95.712891]"
"Doon Buggy Winery, US","430 East U.S. Highway 6, Valparaiso, IN 46383, USA","[41.5483499, -86.9784978]"
"Garbó Winery, Spain",Spain,"[40.46366700000001, -3.74922]"
"Casa Valduga Winery, Brazil",Brazil,"[-14.235004, -51.92528]"
"Calendar Girl Winery, US",,
"Primus Winery, Chile",Chile,"[-35.675147, -71.542969]"
"Redd Brand Winery, US",,
"Château de Nardon Winery, France","2290 S French Rd, Lake Leelanau, MI 49653, USA","[44.9484416, -85.7551398]"
"Tulpen Winery, US",,
"Château le Piat Winery, France",France,"[46.227638, 2.213749]"
"Channing Daughters Winery, US","1927 Scuttle Hole Rd, Bridgehampton, NY 11932, USA","[40.9623879, -72.3114837]"
"Tenuta dei Pianali Winery, Italy",Italy,"[41.87194, 12.56738]"
"Conde de Siruela Winery, Spain","Calle Sol de la Cabra, 26220 Ollauri, La Rioja, Spain","[42.541551, -2.835114]"
"Makura Estate Winery, Israel",Israel,"[32.63925, 34.991606]"
"Gratia Winery, Argentina",Argentina,"[-38.416097, -63.61667199999999]"
"Saveé Sea Winery, New Zealand",New Zealand,"[-40.900557, 174.885971]"
"I Balzini Winery, Italy",,
"Snapping Turtle Winery, US",,
"Nobilo Winery, New Zealand","45 Station Rd, Huapai, Kumeu 0810, New Zealand","[-36.7748379, 174.5379794]"
"Domaine Terlato & Chapoutier Winery, Australia",Australia,"[-25.274398, 133.775136]"
"Ghost Gum Winery, Australia",Australia,"[-25.274398, 133.775136]"
"Corbett Canyon Winery, US",,
"Paul Thomas Winery, US",,
"Noviello Winery, US",,
"Wakefield Bay Winery, New Zealand",New Zealand,"[-40.900557, 174.885971]"
"Vaya Vadiso Winery, Chile",Chile,"[-35.675147, -71.542969]"
"Soleca Winery, Chile",Chile,"[-35.675147, -71.542969]"
"Cavit Winery, Italy","Via del Ponte, 31, 38123 Ravina TN, Italy","[46.0414635, 11.1131139]"
"Beach Kite Winery, Chile",Chile,"[-35.675147, -71.542969]"
"flipflop Winery, Chile",Chile,"[-35.675147, -71.542969]"
"Piegaia Winery, Italy",Italy,"[41.87194, 12.56738]"
"Kissos Winery, US",,
"Domaine du Chalet Pouilly Winery, France","71960 Solutré-Pouilly, France","[46.296943, 4.727157]"
"Viridiana Winery, Spain",Spain,"[40.46366700000001, -3.74922]"
"SonVida Winery, Argentina",Argentina,"[-38.416097, -63.61667199999999]"
"Hacormim Winery, Israel","Alon ha-Tavor St, Caesarea, Israel","[32.6331587, 35.3619834]"
"Quimay Winery, Argentina",Argentina,"[-38.416097, -63.61667199999999]"
"The Divining Rod Winery, US",,
"Brady Family Winery, US","1090 US-206, Shamong, NJ 08088, USA","[39.791358, -74.73673699999999]"
"Trapezio Winery, Argentina",Argentina,"[-38.416097, -63.61667199999999]"
"Sabotage Winery, US",,
"Chalone Winery, US","32020 Stonewall Canyon Rd, Soledad, CA 93960, USA","[36.4701483, -121.2298501]"
"Vins El Cep Winery, Spain","Lugar Can Llopart Alzines, s/n, 08770 Sant Sadurní d'Anoia, Barcelona, Spain","[41.4542711, 1.8072171]"
"Aje Winery, US","322 Healdsburg Ave, Healdsburg, CA 95448, USA","[38.6113055, -122.8704785]"
"Sarotto Winery, Italy","Via Ronconuovo 13, 12050 Neviglie CN, Italy","[44.6870398, 8.1331389]"
"Stemmler Winery, US",,
"Château Maison Blanche Winery, France",France,"[46.227638, 2.213749]"
"Epilogue Winery, US",,
"Les Parcelles de Stéphane Derenoncourt Winery, France",France,"[46.227638, 2.213749]"
"San Nicolas Winery, Chile","Requínoa, Requinoa, O'Higgins Region, Chile","[-34.312304, -70.8279488]"
"Huntington Winery, US","6808 US-24, Huntington, IN 46750, USA","[40.9295346, -85.38658029999999]"
"Con Carne Winery, Chile",Chile,"[-35.675147, -71.542969]"
"Poderi Angelini Winery, Italy",Italy,"[41.87194, 12.56738]"
"Tritano Winery, Italy",Italy,"[41.87194, 12.56738]"
"Finnegan's Lake Winery, US",United States,"[37.09024, -95.712891]"
"Ribbon Cliff Winery, US",,
"Sola Winery, US",,
"Bautista Simona Winery, Argentina",Argentina,"[-38.416097, -63.61667199999999]"
"True Myth Winery, US","5828 Orcutt Rd, San Luis Obispo, CA 93401, USA","[35.227335, -120.599702]"
"Marcolino Sebo Winery, Portugal",Portugal,"[39.39987199999999, -8.224454]"
"Château Haut Vieux Chêne Winery, France",France,"[46.227638, 2.213749]"
"Château Jean de Bel Air Winery, France","33570 Puisseguin, France","[44.92932099999999, -0.074093]"
"Conde Bel Winery, Spain","Calle Sol de la Cabra, 26220 Ollauri, La Rioja, Spain","[42.541551, -2.835114]"
"Château Taussin Winery, France","2290 S French Rd, Lake Leelanau, MI 49653, USA","[44.9484416, -85.7551398]"
"Putah Creek Winery, US","35265 Willow Ave, Clarksburg, CA 95612, USA","[38.4223983, -121.5321672]"
"Sexual Chocolate Winery, US",,
"Öko Winery, Argentina",Argentina,"[-38.416097, -63.61667199999999]"
"Hibou Winery, US",,
"Château Fonfroide Winery, France",France,"[46.227638, 2.213749]"
"Kelby James Russell Winery, US",,
"Ca' dei Mandorli Winery, Italy","Via Stanzano, 2160, 40024 Castel San Pietro Terme BO, Italy","[44.4035972, 11.5544118]"
"WillowBrook Cellars Winery, US","951 East 119th St S, Peck, KS 67120, USA","[37.475421, -97.32403300000001]"
"J. Bäumer Winery, Germany",Germany,"[51.165691, 10.451526]"
"San Marcos Creek Winery, US","7750 US-101, Paso Robles, CA 93446, USA","[35.7135525, -120.695865]"
"Bodegas y Viñedos Noe Winery, Spain","N-122 Km. 274.5, 09391 Castrillo de la Vega, Burgos, Spain","[41.661904, -3.7468516]"
"Dilao Winery, Georgia",Georgia,"[42.315407, 43.35689199999999]"
"Hilt & Blade Winery, US",United States,"[37.09024, -95.712891]"
"Rockroom Winemaking Cooperative Winery, US",,
"Cumbre of Vine Hill Winery, US",United States,"[37.09024, -95.712891]"
"Underground Wine Project Winery, US",,
"Karl Josef Winery, Germany",Germany,"[51.165691, 10.451526]"
"Bodegas Paso Robles Winery, US","729 13th St, Paso Robles, CA 93446, USA","[35.6278783, -120.6908023]"
"Murphy's Law Winery, US",,
"Crossfork Creek Winery, US",United States,"[37.09024, -95.712891]"
"Secondo Marco Winery, Italy","37022 Fumane, VR, Italy","[45.53563500000001, 10.884318]"
"Véronique Günther-Chereau Winery, France","Le Coin, 44690 Saint-Fiacre-sur-Maine, France","[47.149545, -1.44461]"
"Quanta Terra Winery, Portugal",Portugal,"[39.39987199999999, -8.224454]"
"Signaterra Winery, US","1883 London Ranch Rd, Glen Ellen, CA 95442, USA","[38.3608081, -122.5427163]"
"De Coelo Winery, US","1883 London Ranch Rd, Glen Ellen, CA 95442, USA","[38.3608081, -122.5427163]"
"Gaël Martin Winery, France",France,"[46.227638, 2.213749]"
"Zefina Winery, US","255410 US-101, Port Angeles, WA 98362, USA","[48.0958486, -123.2977018]"
"Side Job Winery, US",,
"Cru Vin Dogs Winery, US",,
"Delbeck Winery, France",France,"[46.227638, 2.213749]"
"Valentin Leflaive Winery, France",France,"[46.227638, 2.213749]"
"Forti del Vento Winery, Italy",,
"Charles-Gilbert de Vindé Winery, France",France,"[46.227638, 2.213749]"
"Michaud Winery, US","32020 Stonewall Canyon Rd, Soledad, CA 93960, USA","[36.4701483, -121.2298501]"
"Grand Bourgeau Winery, France",France,"[46.227638, 2.213749]"
"Torlasco Winery, Italy",Italy,"[41.87194, 12.56738]"
"Jed Wines, Argentina",Argentina,"[-38.416097, -63.61667199999999]"
"Maison Malet Roquefort Winery, France","La Gaffelière-Ouest, 33330 Saint-Émilion, France","[44.88551, -0.157011]"
"Monfort-Bellevue Winery, France",France,"[46.227638, 2.213749]"
"Château Timberlay Winery, France",France,"[46.227638, 2.213749]"
"Château Tour de Guiet Winery, France","1 La Bretonnière, 33390 Mazion, France","[45.1801935, -0.5953316]"
"Bossy Boots Winery, Chile",Chile,"[-35.675147, -71.542969]"
"Terre di Talamo Winery, Italy",Italy,"[41.87194, 12.56738]"
"Hillersden Winery, New Zealand","#105, 4055, 4700, W Jefferson Blvd, Los Angeles, CA 90016, United States","[34.0253095, -118.347467]"
"Giocato Winery, Slovenia",Slovenia,"[46.151241, 14.995463]"
"Tanner DaFoe Winery, US",,
"Waters Winery, US","17153 County Rd 1380, Anadarko, OK 73005, USA","[35.0139761, -98.3246487]"
"Château Providence Winery, France","33460 Margaux, France","[45.04443, -0.6687565999999999]"
"Gavilan Winery, US","32020 Stonewall Canyon Rd, Soledad, CA 93960, USA","[36.4701483, -121.2298501]"
"Shane Wines, US",,
"Monasterio de las Viñas Winery, Spain","Km 45,7, Ctra. Valencia, 50400 Cariñena, Zaragoza, Spain","[41.3621708, -1.2074232]"
"Reula Winery, Spain",Spain,"[40.46366700000001, -3.74922]"
"Ku Dé Ta Winery, Argentina",Argentina,"[-38.416097, -63.61667199999999]"
"Inglenook Winery, US","1991 St Helena Hwy, Rutherford, CA 94573, USA","[38.45838670000001, -122.4237959]"
"Château Cru de Verdun Winery, France","1 Cours de Verdun, 33460 Margaux, France","[45.041003, -0.6828557]"
"Curveball Winery, US",,
"Ancilla Winery, Italy",Italy,"[41.87194, 12.56738]"
"Reasons Winery, US",,
"Silver Totem Winery, US",,
"Kon Tiki Winery, Chile",Chile,"[-35.675147, -71.542969]"
"Château Labesse Winery, France","2290 S French Rd, Lake Leelanau, MI 49653, USA","[44.9484416, -85.7551398]"
"Ben Ish Winery, US",,
"Château Fleur de Plaisance Winery, France","256 Plaisance, 33330 Saint-Émilion, France","[44.860021, -0.173013]"
"Château Haut Peyruguet Winery, France","LD La Garrigue, 24240 Saussignac, France","[44.80656399999999, 0.328731]"
"Château Saint-Florian Winery, France",France,"[46.227638, 2.213749]"
"Familia Deicas Winery, ",,
"Arcadian Winery, US","19203 Old U.S. 40, Higginsville, MO 64037, USA","[39.0003838, -93.75373160000001]"
"Araldica Winery, Italy","2 Viale Pietro Laudano, Castel Boglione, At 14040, Italy","[44.7207254, 8.383769899999999]"
"Garnet Vineyards, US","645 Devlin Rd, Napa, CA 94558, USA","[38.2193043, -122.2633759]"
"Château l'Escadre Winery, France","L'Escadre, 33390 Cars, France","[45.12436599999999, -0.615283]"
"Château Pillebois Winery, France",France,"[46.227638, 2.213749]"
"Château Tassin Winery, France",France,"[46.227638, 2.213749]"
"Eisold-Smith Winery, US",,
"Légende Winery, France","33250 Pauillac, France","[45.2249531, -0.7724358]"
"Pontecilla Winery, Spain",Spain,"[40.46366700000001, -3.74922]"
"Sierra de Viento Winery, Spain",Spain,"[40.46366700000001, -3.74922]"
"Maison Duhard Winery, France",France,"[46.227638, 2.213749]"
"Wandering Grape Winery, Argentina",Argentina,"[-38.416097, -63.61667199999999]"
"Arge & Tina Winery, Argentina",Argentina,"[-38.416097, -63.61667199999999]"
"Château Pichon Longueville Comtesse de Lalande Winery, France","33250 Pauillac, France","[45.1761715, -0.7499747999999999]"
"Château Lagrange Winery, France","33250 Saint-Julien-Beychevelle, France","[45.1494936, -0.7731253]"
"Château Ormes de Pez Winery, France",,
"Saint K Winery, US","2829 US-50, Beaufort, MO 63013, USA","[38.4322575, -91.1160261]"
"Mas de Subirà Winery, Spain","Finca Mas den Gil, s/n, 43738 Bellmunt del Priorat, Tarragona, Spain","[41.153889, 0.7659619999999999]"
"Jovino Winery, US","240 SE 5th St, Dundee, OR 97115, USA","[45.2795302, -123.0078417]"
"Finca Hispana Winery, Spain",Spain,"[40.46366700000001, -3.74922]"
"Château la Chapelle Despagnet Winery, France",France,"[46.227638, 2.213749]"
"Greg Norman California Estates Winery, US","600 Airpark Rd, Napa, CA 94558, USA","[38.2191699, -122.2691992]"
"Domaines Dominique Piron Winery, France","69910 Villié-Morgon, France","[46.146197, 4.68119]"
"G & L Lurton Winery, US","10603 Chalk Hill Rd, Healdsburg, CA 95448, USA","[38.579754, -122.774537]"
"Tosalet Winery, Spain","Calle de la Muela, 16, 03737 Xàbia, Alicante, Spain","[38.7919649, 0.1274321]"
"Château des Rontets Winery, France",France,"[46.227638, 2.213749]"
"Bruliam Winery, US",,
"Decibel Winery, New Zealand",New Zealand,"[-40.900557, 174.885971]"
"Château Beauséjour Winery, France","33330 Saint-Émilion, France","[44.892394, -0.1646876]"
"Château Braude Fellonneau Winery, France","8 Avenue Jean Luc Vonderheyden, 33460 Arsac, France","[44.995245, -0.6917310000000001]"
"Château la Garricq Winery, France","50 Rue Pouge de Beau, 33290 Ludon-Médoc, France","[44.985355, -0.6321289999999999]"
"Verdes Castros Winery, Spain",Spain,"[40.46366700000001, -3.74922]"
"Spanish Vines Winery, Spain",Spain,"[40.46366700000001, -3.74922]"
"Domaines Paul Mas Winery, France","D5, Route de villeveyrac, 34530 Montagnac, France","[43.488586, 3.517665]"
"La Vuelta Winery, Argentina",Argentina,"[-38.416097, -63.61667199999999]"
"Villa Mora Winery, Italy",Italy,"[41.87194, 12.56738]"
"WildStock Winery, US","128 S Pine St, Carlton, OR 97111, USA","[45.2937123, -123.1767668]"
"Pierre Chardigny Winery, France",France,"[46.227638, 2.213749]"
"Hors Categorie Winery, US",,
"Fattoria la Castellina Winery, Italy","Viale della Rimembranza, 28, 53011 Castellina in Chianti SI, Italy","[43.468945, 11.286052]"
"Château Dame Jane Winery, France",France,"[46.227638, 2.213749]"
"Château du Vallier Winery, France","Grand Jean, 33760 Soulignac, France","[44.7019136, -0.2832454]"
"Painous Winery, Spain",Spain,"[40.46366700000001, -3.74922]"
"My Essential Winery, France",France,"[46.227638, 2.213749]"
"Domaine Dupré Winery, France","69430 Les Ardillats, France","[46.175795, 4.541647]"
"Domaine Victor Sornin Winery, France",,
"Cloak & Dagger Winery, US",,
"Inherit the Sheep Winery, US",,
"Jordan Stellenbosch Winery, South Africa","Stellenbosch Kloof Road, Vlottenberg, Stellenbosch, 7604, South Africa","[-33.942956, 18.744216]"
"Teddy Hall Winery, South Africa",South Africa,"[-30.559482, 22.937506]"
"Sivi Winery, Slovenia",Slovenia,"[46.151241, 14.995463]"
"Marcella Giuliani Winery, Italy",Italy,"[41.87194, 12.56738]"
"Marqués de Montañana Winery, Spain",Spain,"[40.46366700000001, -3.74922]"
"Morworth Estate Winery, New Zealand","198 Church Rd, Poraiti, Napier 4112, New Zealand","[-39.5184741, 176.8448458]"
"Varaschin Winery, Italy",,
"Vettori Winery, Italy",,
"Mionetto Winery, Italy",,
"TimberRock Winery, US",,
"Stanley Lambert Winery, Australia",,
"Santos Beck Winery, Argentina",,
"Christian Lazo Winery, US",,
"Domenico de Bertiol Winery, Italy",,
"Bodegas Julián Chivite Winery, Spain",,
"Vigne Matte Winery, Italy",,
"Achaia Clauss Winery, Greece",,
"Darjean Jones Winery, US",,
"Cornerstone Winery, US",,
"Nicolas Idiart Winery, France",,
"CARM Winery, Portugal",,
"The Lane Winery, Australia",,
"Hunter's Winery, New Zealand",,
"I Veroni Winery, Italy",,
"Bellingham Winery, South Africa",,
"Domaine Cheysson Winery, France",,
"Pikes Winery, Australia",,
"Tenuta di Lilliano Winery, Italy",,
"Terrabianca Winery, Italy",,
"Calina Winery, Chile",,
"ChÃ¢teau du ChÃ¢telard Winery, France",,
"Opta Winery, Portugal",,
"Signae Winery, Italy",,
"Thorn Winery, US",,
"Auburn Winery, US",,
"Bogati Winery, US",,
"ChÃ¢teau du Luc Winery, France",,
"ChÃ¢teau Haut Cormier Winery, France",,
"ChÃ¢teau la Guillaumette Winery, France",,
"ChÃ¢teau les Roques Winery, France",,
"ChÃ¢teau Roc de Boissac Winery, France",,
"David Bruce Winery, US",,
"DiStefano Winery, US",,
"Domaine Poli Winery, France",,
"Domaine Torraccia Winery, France",,
"Global Wines, Portugal",,
"Luke Winery, US",,
"Massimo Ronca Winery, Italy",,
"Nelson Neves Winery, Portugal",,
"Prophecy Winery, US",,
"Farina Winery, Italy",,
"Les Vignerons de Tautavel Vingrau Winery, France",,
"Louis Bouillot Winery, France",,
"Domaine du Clos des FÃ©es Winery, France",,
"Finca Tobella Winery, Spain",,
"Quinta Vale Dona Maria Winery, Portugal",,
"Recchia Winery, Italy",,
"La Dama Winery, Italy",,
"Mansfield-Dunne Winery, US",,
"Muirwood Winery, US",,
"Nine North Wine Company Winery, US",,
"Tenor Winery, US",,
"Graveyard Winery, US",,
"Hedges Winery, US",,
"Hensteeth Winery, US",,
"Jean Reverdy et Fils Winery, France",,
"Killian Winery, US",,
"Kristodd Winery, US",,
"Les Vignerons de Tavel Winery, France",,
"Enzo Boglietti Winery, Italy",,
"Vega MontÃ¡n Winery, Spain",,
"Cantina del Taburno Winery, Italy",,
"Casa Marin Winery, Chile",,
"ChÃ¢teau Bernadotte Winery, France",,
"ChÃ¢teau Brown Winery, France",,
"ChÃ¢teau Deyrem Valentin Winery, France",,
"ChÃ¢teau la Cabanne Winery, France",,
"ChÃ¢teau Les Palais Winery, France",,
"Agrinatura Winery, Italy",,
"Rustenberg Winery, South Africa",,
"Santa Lucia Winery, Italy",,
"Stefano Accordini Winery, Italy",,
"Nanny Goat Winery, New Zealand",,
"Tenuta Vitalonga Winery, Italy",,
"Vera Winery, Portugal",,
"Rontana Winery, Italy",,
"Tenuta Amalia Winery, Italy",,
"Roccafiore Winery, Italy",,
"Castelli del Grevepesa Winery, Italy",,
"Eberle Winery, US",,
"Shalestone Winery, US",,
"Tierce Winery, US",,
"Tornesi Winery, Italy",,
"Veglio Winery, Italy",,
"ChÃ¢teau de Hauterive Winery, France",,
"Domaine CauhapÃ© Winery, France",,
"Altamana Winery, Chile",,
"Il Conventino Winery, Italy",,
"Peregrine Winery, New Zealand",,
"Pietracupa Winery, Italy",,
"Roblar Winery, US",,
"Sevilen Winery, Turkey",,
"Tierras Guindas Winery, Spain",,
"Kaella Winery, US",,
"Leoness Winery, US",,
"Luna Beberide Winery, Spain",,
"Maison Champy Winery, France",,
"Domaine Chantal Lescure Winery, France",,
"Podere La Vigna Winery, Italy",,
"Poggio Rubino Winery, Italy",,
"San Filippo Winery, Italy",,
"Lazzeretti Winery, Italy",,
"Locati Cellars Winery, US",,
"Mauro Sebaste Winery, Italy",,
"Merry Cellars Winery, US",,
"Pasquale Pelissero Winery, Italy",,
"Pinino Winery, Italy",,
"Tassi Winery, Italy",,
"ChÃ¢teau Ducasse Winery, France",,
"ChÃ¢teau Escot Winery, France",,
"ChÃ¢teau Hourtin-Ducasse Winery, France",,
"ChÃ¢teau Picoron Winery, France",,
"ChÃ¢teau Reysson Winery, France",,
"ChÃ¢teau Tanesse Winery, France",,
"GoulÃ©e Winery, France",,
"Ancien Winery, US",,
"Boheme Winery, US",,
"ChÃ¢teau Durfort-Vivens Winery, France",,
"ChÃ¢teau la Dominique Winery, France",,
"GarmÃ³n Winery, Spain",,
"Gigi Rosso Winery, Italy",,
"Rossi Wallace Winery, US",,
"Block Wines, US",,
"Carucci Winery, US",,
"ChÃ¢teau Rauzan-SÃ©gla Winery, France",,
"La Jota Vineyard, US",,
"Portfolio Winery, US",,
"ChÃ¢teau LÃ©oville Barton Winery, France",,
"Herman Story Winery, US",,
"ChÃ¢teau Pichon Longueville Winery, France",,
"Far Niente Winery, US",,
"Le Piane Winery, Italy",,
"Macauley Winery, US",,
"Camille Giroud Winery, France",,
"Domaine de la Pousse d'Or Winery, France",,
"Roberto Sarotto Winery, Italy",,
"Germano Angelo Winery, Italy",,
"Bric Cenciurio Winery, Italy",,
"Baileyana Winery, US",,
"Domaine Jean Foillard Winery, France",,
"Quinta do Passadouro Winery, Portugal",,
"Felsina Winery, Italy",,
"Fritz Winery, US",,
"Chateau St. Jean Winery, US",,
"Domaine Chignard Winery, France",,
"Dievole Winery, Italy",,
"San Fabiano Calcinaia Winery, Italy",,
"Mount Langi Ghiran Winery, Australia",,
"Coriole Winery, Australia",,
"Ata Rangi Winery, New Zealand",,
"Jean-Paul Thevenet Winery, France",,
"Santa Helena Winery, Chile",,
"ChÃ¢teau Pierre de Montignac Winery, France",,
"Clos de Haute-Combe Winery, France",,
"Domaine des Nugues Winery, France",,
"MatanÃ© Winery, Italy",,
"Misiones de Rengo Winery, Chile",,
"Redhawk Winery, US",,
"Seven Bridges Winery, US",,
"Axios Winery, US",,
"ChÃ¢teau Bouissel Winery, France",,
"ViÃ±edos de Paganos Winery, Spain",,
"Giuseppe Cortese Winery, Italy",,
"Cent'Anni Winery, US",,
"Domaine GÃ©rard Fiou Winery, France",,
"Fattoria Le Pupille Winery, Italy",,
"Domaine Jean-Paul Balland Winery, France",,
"Sinor-LaVallee Winery, US",,
"Baer Winery, US",,
"Molnar Family Winery, US",,
"Bodega Aconquija Winery, Argentina",,
"Spindrift Cellars Winery, US",,
"Luis Alegre Winery, Spain",,
"Farnese Winery, Italy",,
"Weinert Winery, Argentina",,
"ChÃ¢teau Lamothe Guignard Winery, France",,
"Creed of Barossa Winery, Australia",,
"Hermann Moser Winery, Austria",,
"Lenikus Winery, Austria",,
"Vignobles Berthier Winery, France",,
"Villa Huesgen Winery, Germany",,
"Fontes da Cunha Winery, Portugal",,
"Gradis'ciutta Winery, Italy",,
"Niedermayr Josef Winery, Italy",,
"Scott Paul Winery, US",,
"St. Urbans-Hof Winery, Germany",,
