"CARM Winery, Portugal",,
"The Lane Winery, Australia",,
"Hunter's Winery, New Zealand",,
"I Veroni Winery, Italy",,
"Bellingham Winery, South Africa",,
"Domaine Cheysson Winery, France",,
"Pikes Winery, Australia",,
"Tenuta di Lilliano Winery, Italy",,
"Terrabianca Winery, Italy",,
"Calina Winery, Chile",,
"Château du Châtelard Winery, France",,
"Opta Winery, Portugal",,
"Signae Winery, Italy",,
"Thorn Winery, US",,
"Auburn Winery, US",,
"Bogati Winery, US",,
"Château du Luc Winery, France",,
"Château Haut Cormier Winery, France",,
"Château la Guillaumette Winery, France",,
"Château les Roques Winery, France",,
"Château Roc de Boissac Winery, France",,
"David Bruce Winery, US",,
"DiStefano Winery, US",,
"Domaine Poli Winery, France",,
"Domaine Torraccia Winery, France",,
"Global Wines, Portugal",,
"Luke Winery, US",,
"Massimo Ronca Winery, Italy",,
"Nelson Neves Winery, Portugal",,
"Prophecy Winery, US",,
"Farina Winery, Italy",,
"Les Vignerons de Tautavel Vingrau Winery, France",,
"Louis Bouillot Winery, France",,
"Domaine du Clos des Fées Winery, France",,
"Finca Tobella Winery, Spain",,
"Quinta Vale Dona Maria Winery, Portugal",,
"Recchia Winery, Italy",,
"La Dama Winery, Italy",,
"Mansfield-Dunne Winery, US",,
"Muirwood Winery, US",,
"Nine North Wine Company Winery, US",,
"Tenor Winery, US",,
"Graveyard Winery, US",,
"Hedges Winery, US",,
"Hensteeth Winery, US",,
"Jean Reverdy et Fils Winery, France",,
"Killian Winery, US",,
"Kristodd Winery, US",,
"Les Vignerons de Tavel Winery, France",,
"Enzo Boglietti Winery, Italy",,
"Vega Montán Winery, Spain",,
"Cantina del Taburno Winery, Italy",,
"Casa Marin Winery, Chile",,
"Château Bernadotte Winery, France",,
"Château Brown Winery, France",,
"Château Deyrem Valentin Winery, France",,
"Château la Cabanne Winery, France",,
"Château Les Palais Winery, France",,
"Agrinatura Winery, Italy",,
"Rustenberg Winery, South Africa",,
"Santa Lucia Winery, Italy",,
"Stefano Accordini Winery, Italy",,
"Nanny Goat Winery, New Zealand",,
"Tenuta Vitalonga Winery, Italy",,
"Vera Winery, Portugal",,
"Rontana Winery, Italy",,
"Tenuta Amalia Winery, Italy",,
"Roccafiore Winery, Italy",,
"Castelli del Grevepesa Winery, Italy",,
"Eberle Winery, US",,
"Shalestone Winery, US",,
"Tierce Winery, US",,
"Tornesi Winery, Italy",,
"Veglio Winery, Italy",,
"Château de Hauterive Winery, France",,
"Domaine Cauhapé Winery, France",,
"Altamana Winery, Chile",,
"Il Conventino Winery, Italy",,
"Peregrine Winery, New Zealand",,
"Pietracupa Winery, Italy",,
"Roblar Winery, US",,
"Sevilen Winery, Turkey",,
"Tierras Guindas Winery, Spain",,
"Kaella Winery, US",,
"Leoness Winery, US",,
"Luna Beberide Winery, Spain",,
"Maison Champy Winery, France",,
"Domaine Chantal Lescure Winery, France",,
"Podere La Vigna Winery, Italy",,
"Poggio Rubino Winery, Italy",,
"San Filippo Winery, Italy",,
"Lazzeretti Winery, Italy",,
"Locati Cellars Winery, US",,
"Mauro Sebaste Winery, Italy",,
"Merry Cellars Winery, US",,
"Pasquale Pelissero Winery, Italy",,
"Pinino Winery, Italy",,
"Tassi Winery, Italy",,
"Château Ducasse Winery, France",,
"Château Escot Winery, France",,
"Château Hourtin-Ducasse Winery, France",,
"Château Picoron Winery, France",,
"Château Reysson Winery, France",,
"Château Tanesse Winery, France",,
"Goulée Winery, France",,
"Ancien Winery, US",,
"Boheme Winery, US",,
"Château Durfort-Vivens Winery, France",,
"Château la Dominique Winery, France",,
"Garmón Winery, Spain",,
"Gigi Rosso Winery, Italy",,
"Rossi Wallace Winery, US",,
"Block Wines, US",,
"Carucci Winery, US",,
"Château Rauzan-Ségla Winery, France",,
"La Jota Vineyard, US",,
"Portfolio Winery, US",,
"Château Léoville Barton Winery, France",,
"Herman Story Winery, US",,
"Château Pichon Longueville Winery, France",,
"Far Niente Winery, US",,
"Le Piane Winery, Italy",,
"Macauley Winery, US",,
"Camille Giroud Winery, France",,
"Domaine de la Pousse d'Or Winery, France",,
"Roberto Sarotto Winery, Italy",,
"Germano Angelo Winery, Italy",,
"Bric Cenciurio Winery, Italy",,
"Baileyana Winery, US",,
"Domaine Jean Foillard Winery, France",,
"Quinta do Passadouro Winery, Portugal",,
"Felsina Winery, Italy",,
"Fritz Winery, US",,
"Chateau St. Jean Winery, US",,
"Domaine Chignard Winery, France",,
"Dievole Winery, Italy",,
"San Fabiano Calcinaia Winery, Italy",,
"Mount Langi Ghiran Winery, Australia",,
"Coriole Winery, Australia",,
"Ata Rangi Winery, New Zealand",,
"Jean-Paul Thevenet Winery, France",,
"Santa Helena Winery, Chile",,
"Château Pierre de Montignac Winery, France",,
"Clos de Haute-Combe Winery, France",,
"Domaine des Nugues Winery, France",,
"Matané Winery, Italy",,
"Misiones de Rengo Winery, Chile",,
"Redhawk Winery, US",,
"Seven Bridges Winery, US",,
"Axios Winery, US",,
"Château Bouissel Winery, France",,
"Viñedos de Paganos Winery, Spain",,
"Giuseppe Cortese Winery, Italy",,
"Cent'Anni Winery, US",,
"Domaine Gérard Fiou Winery, France",,
"Fattoria Le Pupille Winery, Italy",,
"Domaine Jean-Paul Balland Winery, France",,
"Sinor-LaVallee Winery, US",,
"Baer Winery, US",,
"Molnar Family Winery, US",,
"Bodega Aconquija Winery, Argentina",,
"Spindrift Cellars Winery, US",,
"Luis Alegre Winery, Spain",,
"Farnese Winery, Italy",,
"Weinert Winery, Argentina",,
"Château Lamothe Guignard Winery, France",,
"Creed of Barossa Winery, Australia",,
"Hermann Moser Winery, Austria",,
"Lenikus Winery, Austria",,
"Vignobles Berthier Winery, France",,
"Villa Huesgen Winery, Germany",,
"Fontes da Cunha Winery, Portugal",,
"Gradis'ciutta Winery, Italy",,
"Niedermayr Josef Winery, Italy",,
"Scott Paul Winery, US",,
"Vigne dei Mastri Winery, Italy",,
"Vignobles Bulliat Winery, France",,
"Arnaud Baillot Winery, France",,
"Bargetto Winery, US",,
"Douro Family Estates Winery, Portugal",,
"Ferrero Winery, Italy",,
"Viñas del Vero Winery, Spain",,
"Pago de Carraovejas Winery, Spain",,
"Corte Pavone Winery, Italy",,
"Cupano Winery, Italy",,
"Domaine de la Grenaudière Winery, France",,
"Domaine Lecomte Winery, France",,
"Adega Cooperativa Ponte de Lima Winery, Portugal",,
"Roger et Didier Raimbault Winery, France",,
"Tamar Ridge Winery, Australia",,
"Vrede en Lust Winery, South Africa",,
"Vasco Sassetti Winery, Italy",,
"Vaza Winery, Spain",,
"Joseph Mellot Winery, France",,
"Château Chatard Winery, France",,
"Ada Nada Winery, Italy",,
"Cascina Bongiovanni Winery, Italy",,
"Casetta Winery, Italy",,
"Bordeaux-style Red Blend Winery, France",,
"Château Gramond Winery, France",,
"Château la Baronnerie Winery, France",,
"Château la Verrière Winery, France",,
"Core Winery, US",,
"Jordan Winery, US",,
"Quinta Seara d'Ordens Winery, Portugal",,
"Familia Deicas Winery, Uruguay",,
"Banero Winery, Italy",,
"Barefoot Winery, US",,
"Bonotto delle Tezze Winery, Italy",,
"Silver Ridge Winery, US",,
"Targovishte Winery, Bulgaria",,
"McManis Winery, US",,
"Emmolo Winery, US",,
"Field Stone Winery, US",,
"Casas del Toqui Winery, Chile",,
"Valle Pradinhos Winery, Portugal",,
"Villaggio Grando Winery, Brazil",,
"oops Winery, Chile",,
"Cerruti Winery, US",,
"Brick House Winery, US",,
"Château Villemaurine Winery, France",,
"Dashe Cellars Winery, US",,
"Dunning Vineyards, US",,
"Schermeister Winery, US",,
"Gypsy Dancer Winery, US",,
"Weatherborne Winery, US",,
"Tobacco Road Winery, US",,
"Arnaldo Caprai Winery, Italy",,
"Blackjack Winery, US",,
"Acorn Winery, US",,
"Castillo Clavijo Winery, Spain",,
"O. Fournier Winery, Spain",,
"Poliziano Winery, Italy",,
"San Elias Winery, Chile",,
"Tololo Winery, Chile",,
"Château Lacombe Noaillac Winery, France",,
"Chono Winery, Chile",,
"Big House Winery, US",,
"Calcu Winery, Chile",,
"Le Cirque Winery, France",,
"Château de Jau Winery, France",,
"P.K.N.T. Winery, Chile",,
"Naia Winery, Spain",,
"Poggio alla Sala Winery, Italy",,
"Tamayo Family Winery, US",,
"Montecillo Winery, Spain",,
"Orchid Hill Winery, US",,
"P2 Winery, US",,
"Rosenthal-Malibu Estate Winery, US",,
"Dominio Buenavista Winery, Spain",,
"Dr. H. Thanisch (Erben Müller-Burggraef) Winery, Germany",,
"Warwick Winery, South Africa",,
"Viña Gormaz Winery, Spain",,
"Surfrider Winery, US",,
"Nepenthe Winery, Australia",,
"Château Peyrabon Winery, France",,
"Clos du Bois Winery, US",,
"Davis Bynum Winery, US",,
"DeTierra Vineyards, US",,
"Domaine Charles Baur Winery, France",,
"Siro Pacenti Winery, Italy",,
"K Squared Cellars Winery, US",,
"Kay Brothers Winery, Australia",,
"Megan Anne Winery, US",,
"Trerose Winery, Italy",,
"Villa Calcinaia Winery, Italy",,
"Vinovalie Winery, France",,
"Wait Cellars Winery, US",,
"Crespi Ranch Winery, US",,
"Domaine D'en Ségur Winery, France",,
"Domaine du Théron Winery, France",,
"Canneto Winery, Italy",,
"Casa Ermelinda Freitas Winery, Portugal",,
"Château Lastours Winery, France",,
"Deer Creek Winery, US",,
"Dr. Bürklin-Wolf Winery, Germany",,
"Il Paradiso di Manfredi Winery, Italy",,
"Château de Bellevue Winery, France",,
"M. Chapoutier Winery, France",,
"PoderNuovo a Palazzone Winery, Italy",,
"The Dancing Fox Winery, US",,
"Leopoldo I di Toscana Winery, Italy",,
"Ogier Winery, France",,
"Podere Monastero Winery, Italy",,
"Poggio Mandorlo Winery, Italy",,
"Semeli Winery, Greece",,
"Tom Eddy Winery, US",,
"Vega Escal Winery, Spain",,
"YNOT Winery, US",,
"KWV Winery, South Africa",,
"Thorntree Winery, South Africa",,
"Castillo de Monjardin Winery, Spain",,
"Masies d'Avinyo Winery, Spain",,
"Arroyo Winery, Spain",,
"Osborne Selección Winery, Spain",,
"Slowine Winery, South Africa",,
"Condesa de Leganza Winery, Spain",,
"Estancia Piedra Winery, Spain",,
"Pursued by Bear Winery, US",,
"Aperture Winery, US",,
"Josef Jamek Winery, Austria",,
"Chenoweth Winery, US",,
"Domaine Saint-André de Figuière Winery, France",,
"Taft Street Winery, US",,
"Monte Clavijo Winery, Spain",,
"Piera Martellozzo Winery, Italy",,
"Siesta Wines, Argentina",,
"Stanburn Winery, US",,
"Bread & Butter Winery, US",,
"Back Seat Winery, US",,
"Domaine Jean Bousquet Winery, Argentina",,
"Tamarí Winery, Argentina",,
"Vinícola de Castilla Winery, Spain",,
"Damas Winery, US",,
"Doukénie Winery, US",,
"Casa de Campo Winery, Argentina",,
"Ranchero Cellars Winery, US",,
"San Antonio Winery, US",,
"Geyerhof Winery, Austria",,
"Domaine du Petit Métris Winery, France",,
"Buchegger Winery, Austria",,
"Lecco Winery, Spain",,
"Saviah Winery, US",,
"Sobrero Winery, Italy",,
"The Tribe Winery, US",,
"Esterházy Winery, Austria",,
"Fidelitas Winery, US",,
"Flywheel Winery, US",,
"Zeal Winery, New Zealand",,
"Andreola Orsola Winery, Italy",,
"Antonini Ceresa Winery, Italy",,
"Christine Andrew Winery, US",,
"Colesel Winery, Italy",,
"Costaripa Winery, Italy",,
"Malibràn Winery, Italy",,
"Strait Jacket Winery, Australia",,
"Viña Santa Cruz Winery, Chile",,
"Hatzimichalis Winery, Greece",,
"Goldwater Winery, New Zealand",,
"Gunn Estate Winery, New Zealand",,
"Bella Luna Winery, US",,
"Vigne Regali Winery, Italy",,
"Hestan Winery, US",,
"Château Julien Winery, US",,
"Cramele Halewood Winery, Romania",,
"Fontanella Winery, US",,
"Tsililis Winery, ",,
"Leda Winery, Spain",,
"Reinhold Haart Winery, Germany",,
"Havens Winery, US",,
"Liparita Winery, US",,
"Tahbilk Winery, Australia",,
"Three Winery, US",,
"Wallis Family Estate Winery, US",,
"Domaine Marcel Deiss Winery, France",,
"Château de Lavernette Winery, France",,
"Hertelendy Winery, US",,
"Addendum Winery, US",,
"Château Simon Winery, France",,
"Conceito Vinhos Winery, Portugal",,
"Keller Winery, US",,
"Kimsey Winery, US",,
"Montemar Wines, US",,
"Quinta do Sobral Winery, Portugal",,
"Chateau Montelena Winery, US",,
"Elizabeth Rose Winery, US",,
"Luretta Winery, Italy",,
"Quinta da Romaneira Winery, Portugal",,
"Dr. Hermann Winery, Germany",,
"Viña Vilano Winery, Spain",,
"Johann Falkenburg Winery, Germany",,
"Ciù Ciù Winery, Italy",,
"Marqués de Riscal Winery, Spain",,
"Maybach Winery, US",,
"Domaine Pichot Winery, France",,
"Petrelli Winery, Italy",,
"Marquis de Goulaine Winery, France",,
"Mocavero Winery, Italy",,
"Wild Coyote Winery, US",,
"For a Song Winery, US",,
"Danielle de l'Ansée Winery, France",,
"Domaine Vincent Carême Winery, France",,
"Stemilt Creek Winery, US",,
"Adega de Favaios Winery, Portugal",,
"Antiquum Farm Winery, US",,
"Cascina delle Rose Winery, Italy",,
"Château de Gayon Winery, France",,
"Della Winery, US",,
"Segal's Winery, Israel",,
"Shiloh Winery, Israel",,
"Envy Winery, US",,
"Bodegas del Muni Winery, Spain",,
"Capa Winery, Spain",,
"Domaine Pouillon Winery, US",,
"J. & F. Lurton Winery, Portugal",,
"Pago de la Jaraba Winery, Spain",,
"Alzania Winery, Spain",,
"Bodegas Bleda Winery, Spain",,
"Matias Riccitelli Winery, Argentina",,
"McGah Family Winery, US",,
"Piazzo Armando Winery, Italy",,
"Purcari Winery, Moldova",,
"Quinta da Casaboa Winery, Portugal",,
"Quinta de Lourosa Winery, Portugal",,
"1912 Winemakers Winery, Portugal",,
"Amici Winery, US",,
"I Sodi Winery, Italy",,
"Adler Fels Winery, US",,
"Balestri Valda Winery, Italy",,
"Carmel Winery, Israel",,
"Cielo Winery, US",,
"Roquevale Winery, Portugal",,
"Ross-idi Winery, ",,
"Tokara Winery, South Africa",,
"Bollig-Lehnert Winery, Germany",,
"Kikelet Winery, Hungary",,
"LangeTwins Winery, US",,
"Corton André Winery, France",,
"Adastra Winery, US",,
"Domaine François Lamarche Winery, France",,
"Schmitges Winery, Germany",,
"Joseph Family Winery, US",,
"Kurt Hain Winery, Germany",,
"Flechas de los Andes Winery, Argentina",,
"Domaine de la Vougeraie Winery, France",,
"JLC Winery, US",,
"Mueller Family Vineyards, US",,
"Sogrape Winery, Portugal",,
"Territorial Winery, US",,
"Domaine Coustarret Winery, France",,
"Boekenoogen Winery, US",,
"Casella Winery, Australia",,
"Dionysos Winery, Greece",,
"Badia a Coltibuono Winery, Italy",,
"Conti Leopardi di San Leopardo Winery, Italy",,
"Hugh Hamilton Winery, Australia",,
"Sensorium Winery, US",,
"Bottega Vinaia Winery, Italy",,
"Russian Hill Winery, US",,
"Sherwood House Vineyards, US",,
"Villa des Anges Winery, France",,
"Lander-Jenkins Winery, US",,
"Laroche Winery, France",,
"Left Bend Winery, US",,
"Mont Marçal Winery, Spain",,
"Old Soul Winery, US",,
"Hervé Kerlann Winery, France",,
"Cantina di Sorbara Winery, Italy",,
"Château du Carrubier Winery, France",,
"Coyote Canyon Winery, US",,
"Domaine de l'Echelette Winery, France",,
"Tamellini Winery, Italy",,
"Three Thieves Winery, US",,
"Trenza Winery, US",,
"Van Loveren Winery, South Africa",,
"Ventolaio Winery, Italy",,
"Cantina di Monteforte Winery, Italy",,
"De Wetshof Winery, South Africa",,
"DeLorimier Winery, US",,
"Domaine de Dauliac Winery, France",,
"Domaine Laleure-Piot Winery, France",,
"Glenelly Winery, South Africa",,
"Luddite Winery, South Africa",,
"Merotto Winery, Italy",,
"Domaine Boyar Winery, Bulgaria",,
"Léon Perdigal Winery, France",,
"Painted Wolf Winery, South Africa",,
"Julien Schaal Winery, France",,
"Nyetimber Winery, England",,
"Galerie Winery, US",,
"Jean Biecher & Fils Winery, France",,
"Joseph Winery, Australia",,
"Schumann-Nägler Winery, Germany",,
"Sorelle Bronca Winery, Italy",,
"Nicholas Cole Cellars Winery, US",,
"J Wrigley Winery, US",,
"Marilena Barbera Winery, Italy",,
"McClean Winery, US",,
"Paramus Winery, Spain",,
"Lake Chalice Winery, New Zealand",,
"Winery at La Grange Winery, US",,
"Spadafora Winery, Italy",,
"Tenuta Gorghi Tondi Winery, Italy",,
"Terrazze dell'Etna Winery, Italy",,
"Alessandro di Camporeale Winery, Italy",,
"Barone Montalto Winery, Italy",,
"Chloe Winery, US",,
"Contrada Santo Spirito di Passopisciaro Winery, Italy",,
"Kana Winery, US",,
"McDermaid Winery, US",,
"Nick Goldschmidt Winery, New Zealand",,
"Castello di Razzano Winery, Italy",,
"Marchesi Alfieri Winery, Italy",,
"Ponga Winery, New Zealand",,
"Roessler Winery, US",,
"Château de Malengin Winery, France",,
"Vincent Couche Winery, France",,
"Hourglass Winery, US",,
"Jean-Claude Boisset Winery, France",,
"Lelarge-Pugeot Winery, France",,
"Dehesa de los Llanos Winery, Spain",,
"I Favati Winery, Italy",,
"Viña Herminia Winery, Spain",,
"Andean Winery, Argentina",,
"Bodegas Fuentespina Winery, Spain",,
"Bizoe Winery, South Africa",,
"Château Barbanau Winery, France",,
"Château Margüi Winery, France",,
"Orsi Family Vineyards, US",,
"Ossian Winery, Spain",,
"Kicker Cane Winery, US",,
"Kontokosta Winery, US",,
"Rigal Winery, France",,
"Tenuta Grimani Winery, Italy",,
"Val di Suga Winery, Italy",,
"Vin Vault Winery, US",,
"Zoetic Wines, US",,
"Cave de Tain Winery, France",,
"Dachshund Winery, Germany",,
"Summerland Winery, US",,
"Tangent Winery, US",,
"Venge Winery, US",,
"Borgo Isolabella Winery, Italy",,
"Castello di Vicarello Winery, Italy",,
"Domaine Guillot-Broux Winery, France",,
"Ghione Winery, Italy",,
"Fabrizio Dionisio Winery, Italy",,
"Finca Decero Winery, Argentina",,
"Due Vigne Winery, US",,
"Hard Row To Hoe Winery, US",,
"Baglio Curatolo Arini 1875 Winery, Italy",,
"Beresan Winery, US",,
"Cabot Vineyards, US",,
"Marqués de Terán Winery, Spain",,
"Maurice Ecard Winery, France",,
"Maurigi Winery, Italy",,
"Jules Taylor Winery, New Zealand",,
"Scilio Winery, Italy",,
"Ciabot Berton Winery, Italy",,
"Alessandro Veglio Winery, Italy",,
"Negretti Winery, Italy",,
"Pingao Winery, Spain",,
"Ruta 22 Winery, Argentina",,
"Sun Garden Winery, Germany",,
"Château du Caillau Winery, France",,
"Chateau Walla Walla Winery, US",,
"Le Grand Vallat Winery, France",,
"Marques de Monistrol Winery, Spain",,
"Monteci Winery, Italy",,
"O Winery, US",,
"Sweet Valley Winery, US",,
"Fernández de Piérola Winery, Spain",,
"Raymond Beck Winery, France",,
"Cristalino Winery, Spain",,
"Buttonwood Farm Winery, US",,
"Thornton Winery, US",,
"Barefoot Cellars Winery, US",,
"Bel Arbor Winery, US",,
"Mumm Cuvée Napa Winery, US",,
"M. Trinchero Winery, US",,
"Newlan Winery, US",,
"Parxet Winery, Spain",,
"Laelaps Winery, US",,
"Lumos Winery, US",,
"Thanisch Winery, Germany",,
"Toni Jost Winery, Germany",,
"Ground Boots Winery, US",,
"Christian Leperchois Winery, France",,
"Weninger Winery, Austria",,
"Château de Costis Winery, France",,
"Château du Cros Winery, France",,
"Château Haut-Mongeat Winery, France",,
"Galante Winery, US",,
"Mesh Winery, Australia",,
"Inman Family Winery, US",,
"Longplay Winery, US",,
"Antonelli Winery, Italy",,
"Caves de Rauzan Winery, France",,
"Château Brethous Winery, France",,
"Tabarrini Winery, Italy",,
"Château Rauzan Despagne Winery, France",,
"Cirulli Winery, Italy",,
"André Kientzler Winery, France",,
"Bodega Rancho Winery, US",,
"Veritas Winery, US",,
"Pasetti Winery, Italy",,
"Picos Pardos Winery, Spain",,
"Štoka Winery, Slovenia",,
"Toriles Winery, Spain",,
"Veedercrest Winery, US",,
"Kracher Winery, Austria",,
"Marqués de Gelida Winery, Spain",,
"Meyer-Fonné Winery, France",,
"Bibich Winery, Croatia",,
"Shypoke Winery, US",,
"Château du Coing de Saint-Fiacre Winery, France",,
"Château Jean-Faure Winery, France",,
"Riverhaven Winery, US",,
"Bouchard Finlayson Winery, South Africa",,
"Churchill Cellars Winery, US",,
"Mountford Winery, New Zealand",,
"Château Béhèré Courtin Winery, France",,
"Château la Tour de Bessan Winery, France",,
"Vieux Château des Templiers Winery, France",,
"Cesarini Sforza Winery, Italy",,
"Domaine des Roches Neuves Winery, France",,
"Vavasour Winery, New Zealand",,
"Viña Mein Winery, Spain",,
"Rocca di Montemassi Winery, Italy",,
"Boscarelli Winery, Italy",,
"Leira Winery, Spain",,
"Morisfarms Winery, Italy",,
"Ormanni Winery, Italy",,
"Quinta da Gaivosa Winery, Portugal",,
"Château La Croix de Queynac Winery, France",,
"Château l'Espérance Winery, France",,
"Croma Vera Winery, US",,
"Demarie Winery, Italy",,
"Ellena Winery, Italy",,
"Encanto Winery, Spain",,
"Finca Jakue Winery, Spain",,
"Taron Winery, Spain",,
"Almquist Winery, US",,
"Aspaldi Winery, Spain",,
"Biegler Winery, Austria",,
"Carravid Winery, Spain",,
"Château Croix de Mission Winery, France",,
"Château du Juge Winery, France",,
"Latah Creek Winery, US",,
"Golser Wein Winery, Austria",,
"Château d'Orschwihr Winery, France",,
"Saggi Winery, US",,
"Scheid Vineyards, US",,
"Iby Winery, Austria",,
"Mas Amiel Winery, France",,
"Arrocal Winery, Spain",,
"Rombauer Winery, US",,
"Domaine Sylvain Pataille Winery, France",,
"Vidon Vineyard, US",,
"Villa Raiano Winery, Italy",,
"Bella Bollè Winery, Italy",,
"Tierra Prometida Winery, Argentina",,
"Stonegate Winery, US",,
"Tapiz Winery, Argentina",,
"Two Oceans Winery, South Africa",,
"Domaine Thierry Mortet Winery, France",,
"Garnet Winery, US",,
"Arbiola Winery, Italy",,
"Quackenbush Winery, US",,
"Tango Reàl Winery, Argentina",,
"Earthquake Winery, US",,
"Artisan Uprising Winery, US",,
"Bodegas Imperiales Winery, Spain",,
"Domaine Coudoulis Winery, France",,
"Weingut Weber Winery, Germany",,
"Castello di Meleto Winery, Italy",,
"Cecchi Winery, Italy",,
"Diadema Winery, Italy",,
"Zacharias Winery, Greece",,
"Espana Robles Winery, US",,
"Molí dels Capellans Winery, Spain",,
"Plozza Winery, Italy",,
"Clos des Verdots Winery, France",,
"Domaine de la Tour Boisée Winery, France",,
"Domaine du Moulin Berger Winery, France",,
"Meerlust Winery, South Africa",,
"Mommessin Winery, France",,
"Valle Winery, Italy",,
"Black Pearl Winery, South Africa",,
"Diamond River Winery, South Africa",,
"Enjoie Winery, US",,
"Gracia de Chile Winery, Chile",,
"Recoletas Winery, Spain",,
"Viña Costeira Winery, Spain",,
"Pueblo del Sol Winery, Uruguay",,
"Brüder Dr. Becker Winery, Germany",,
"Caves Cooperatives de Donnas Winery, Italy",,
"Edetària Winery, Spain",,
"Weingut Georg Albrecht Schneider Winery, Germany",,
"Marangona Winery, Italy",,
"Peter Zemmer Winery, Italy",,
"Rhiannon Winery, US",,
"Terre de Vignerons Winery, France",,
"Château Les Bertrands Winery, France",,
"Salton Winery, Brazil",,
"Château Marot Winery, France",,
"Gray Ghost Winery, US",,
"Junta Winery, Chile",,
"Mario Perelli-Minetti Winery, US",,
"Salvestrin Winery, US",,
"Horton Winery, US",,
"Marichal Winery, Uruguay",,
"Luce della Vite Winery, Italy",,
"Baiting Hollow Farm Vineyard, US",,
"Château de la Grenière Winery, France",,
"Château de Sainte-Gemme Winery, France",,
"Cupcake Winery, Argentina",,
"Cà dei Frati Winery, Italy",,
"Chacewater Winery, US",,
"Château de Berne Winery, France",,
"Château Minuty Winery, France",,
"Château Roubine Winery, France",,
"Clos LaChance Winery, US",,
"Expression 39 Winery, US",,
"Fabre Montmayou Winery, Argentina",,
"Wieninger Winery, Austria",,
"Ancient Peaks Winery, US",,
"Château Saint-Maur Winery, France",,
"Chêne Winery, US",,
"Citari Winery, Italy",,
"Den Hoed Winery, US",,
"Feudo Arancio Winery, Italy",,
"Feudo Disisa Winery, Italy",,
"Feudo Monaci Winery, Italy",,
"Flam Winery, Israel",,
"Ara Winery, New Zealand",,
"Bazelet HaGolan Winery, Israel",,
"Belhurst Winery, US",,
"Convento San Francisco Winery, Spain",,
"Domaine Chasselay Winery, France",,
"Lujon Winery, US",,
"Mahoney Winery, US",,
"Swirl Winery, US",,
"Altozano Winery, Spain",,
"Baron Philippe de Rothschild Winery, France",,
"Bodega NQN Winery, Argentina",,
"Bowtie Winery, US",,
"Château Briot Winery, France",,
"Château Chaubinet Winery, France",,
"Château de Lugagnac Winery, France",,
"Château Gabaron Winery, France",,
"Château Vieux Ferrand Winery, France",,
"Don Olegario Winery, Spain",,
"Cortenova Winery, Italy",,
"Pasqua Winery, Italy",,
"San Huberto Winery, Argentina",,
"Sirius Winery, France",,
"Louis Drescher Winery, Spain",,
"Finca Los Maza Winery, Argentina",,
"Deep Sea Winery, US",,
"Des Voigne Cellars Winery, US",,
"Collegiale des Domaines de Loire Winery, France",,
"Bougrier Winery, France",,
"Cavazza Winery, Italy",,
"Nobilissima Winery, Italy",,
"Baldi Winery, Italy",,
"Biancariva Winery, Italy",,
"Roos Family Winery, South Africa",,
"Mancan Winery, US",,
"Adria Vini Winery, Italy",,
"Art of Earth Winery, Germany",,
"Albert Besombes Winery, France",,
"Amore di Amanti Winery, Italy",,
"Les Vignerons du Pallet Winery, France",,
"La Zorra Winery, Spain",,
"Black Hills Winery, Canada",,
"Hillinger Winery, Austria",,
"Lagler Winery, Austria",,
"Muhr-Van der Niepoort Winery, Austria",,
"Painted Rock Winery, Canada",,
"Mantlerhof Winery, Austria",,
"Mario Gagliasso Winery, Italy",,
"Burbank Ranch Winery, US",,
"Church & State Winery, Canada",,
"Corvus Winery, US",,
"Vinha Paz Winery, Portugal",,
"Podere Sapaio Winery, Italy",,
"Quinta do Quetzal Winery, Portugal",,
"Brogan Winery, US",,
"Grattamacco Winery, Italy",,
"Cola Winery, Italy",,
"Domaine les Cantates Winery, France",,
"Fattoria di Grignano Winery, Italy",,
"Ferghettina Winery, Italy",,
"Dr. Pauly Bergweiler Winery, Germany",,
"Veuve Clicquot Ponsardin Winery, France",,
"Villa Winery, Italy",,
"Dezzani Winery, Italy",,
"Lagar del Rey Winery, Spain",,
"Mas d'en Gil Winery, Spain",,
"Poderi Elia Winery, Italy",,
"Portal del Priorat Winery, Spain",,
"Cantina Terre del Barolo Winery, Italy",,
"Castillo's Hillside Shire Winery, US",,
"Château La Greffière Winery, France",,
"Domaine de Cabriac Winery, France",,
"J.R. Dill Winery, US",,
"San Silvestro Winery, Italy",,
"Pelissero Winery, Italy",,
"Peter Lehmann Winery, Australia",,
"Selene Winery, US",,
"Stephen & Walker Winery, US",,
"Pe're Alessandro Winery, Italy",,
"Roagna Winery, Italy",,
