"CARM Winery, Portugal",,
"Jerusalem Wineries Winery, Israel",,
"Kobler Winery, US",,
"Makura Estate Winery, Israel",,
"Gratia Winery, Argentina",,
"Ozwell Vintners Winery, Australia",,
"Raffaldini Winery, US",,
"Tezza Winery, Italy",,
"Gordonzello Winery, Spain",,
"Barrel Oak Winery, US",,
"Fornacelle Winery, Italy",,
"Monte do Pintor Winery, Portugal",,
"Quinta do Ameal Winery, Portugal",,
"Saveé Sea Winery, New Zealand",,
"House of Nobilo Winery, New Zealand",,
"I Balzini Winery, Italy",,
"Jean-Pierre et Michel Auvigué Winery, France",,
"Albis Winery, Chile",,
"Rasi Winery, US",,
"The Bridge Winery, US",,
"McCall Winery, US",,
"Timbre Winery, US",,
"Berger Winery, Austria",,
"Chateau Margene Winery, US",,
"Domaine du Clos de l'Elu Winery, France",,
"Dawn's Dream Winery, US",,
"Snapping Turtle Winery, US",,
"Tenuta Barone Nicolò La Lumia Winery, Italy",,
"Nobilo Winery, New Zealand",,
"Preston Winery, US",,
"Mt. Difficulty Winery, New Zealand",,
"Pauletts Winery, Australia",,
"Château Certan Winery, France",,
"Château de Myrat Winery, France",,
"Château des Laudes Winery, France",,
"Château Laffitte Carcasset Winery, France",,
"Château Violette Winery, France",,
"Domaine la Mereuille Winery, France",,
"Domaine Terlato & Chapoutier Winery, Australia",,
"La Follette Winery, US",,
"Bentley Winery, US",,
"Bisceglia Winery, Italy",,
"Château Cantemerle Winery, France",,
"Château d'Hanteillan Winery, France",,
"Château Lestage Winery, France",,
"Château Siran Winery, France",,
"Element Winery, Australia",,
"Kunin Winery, US",,
"Rosemount Winery, Australia",,
"Mount Palomar Winery, US",,
"Ghost Gum Winery, Australia",,
"Corbett Canyon Winery, US",,
"Logan Australia Winery, Australia",,
"Stratford Winery, US",,
"Owen's Estate Winery, Australia",,
"Paul Thomas Winery, US",,
"Penmara Winery, Australia",,
"Hamelin Bay Winery, Australia",,
"Noviello Winery, US",,
"Rosa d'Oro Winery, US",,
"Produttori Vini Manduria Winery, Italy",,
"North by Northwest Winery, US",,
"Rocca del Dragone Winery, Italy",,
"Statti Winery, Italy",,
"Tenute Orestiadi Winery, Italy",,
"Steiner Family Vineyards, US",,
"Wakefield Bay Winery, New Zealand",,
"Vaya Vadiso Winery, Chile",,
"Vinterra Winery, US",,
"La Canosa Winery, Italy",,
"Sonoma Cuvée Winery, US",,
"Soleca Winery, Chile",,
"Clara Marcelli Winery, Italy",,
"Domaine du Colombier Winery, France",,
"Coffele Winery, Italy",,
"Díaz Bayo Winery, Spain",,
"Domaine Mersiol Winery, France",,
"Faniel et Fils Winery, France",,
"The Crossings Winery, New Zealand",,
"Alexana Winery, US",,
"Berryhill Winery, US",,
"Bestheim Winery, France",,
"Austin Hope Winery, US",,
"Cavit Winery, Italy",,
"J. & F. Lurton Winery, France",,
"Domaine les Loges de la Folie Winery, France",,
"Quinta do Carmo Winery, Portugal",,
"Quinta do Gradil Winery, Portugal",,
"Sumarroca Winery, Spain",,
"Maccari Spumanti Winery, Italy",,
"Vega Barcelona Winery, Spain",,
"La Riva dei Frati Winery, Italy",,
"Capafons-Ossó Winery, Spain",,
"Charles Heintz Winery, US",,
"William Hatcher Winery, US",,
"Cuvaison Winery, US",,
"La Montagne Winery, US",,
"Goldeneye Winery, US",,
"Sonnet Winery, US",,
"Domaine de Frégate Winery, France",,
"Domaine d'Eole Winery, France",,
"Flying Horse Winery, US",,
"Montecappone Winery, Italy",,
"Nodland Winery, US",,
"Northwest Collection Winery, US",,
"Château de Lisennes Winery, France",,
"Château Haut Bages Libéral Winery, France",,
"Jorche Winery, Italy",,
"Drytown Winery, US",,
"Emeri Winery, Australia",,
"Talaria Winery, US",,
"Tenute Mater Domini Winery, Italy",,
"EBGB Winery, Chile",,
"Greg Norman Estates Winery, Australia",,
"Carma Winery, Chile",,
"Beach Kite Winery, Chile",,
"flipflop Winery, Chile",,
"Boundary Breaks Winery, US",,
"Château Ambe Tour Pourret Winery, France",,
"Steindorfer Winery, Austria",,
"Erwin Sabathi Winery, Austria",,
"Five Star Cellars Winery, US",,
"Burgess Winery, US",,
"Vinex Slavyantsi Winery, Bulgaria",,
"JC Cellars Winery, US",,
"La Colombaia Winery, Italy",,
"Piegaia Winery, Italy",,
"Love and Meritage Winery, US",,
"Myriad Cellars Winery, US",,
"Bellacana Winery, US",,
"Domaine Céline et Frédéric Gueguen Winery, France",,
"H. Abrantes Douro Wines, Portugal",,
"Bricco Mondalino Winery, Italy",,
"Gaul Winery, Germany",,
"460 Casina Bric Winery, Italy",,
"Noble Tree Winery, US",,
"Rapido Red Winery, Italy",,
"Colle dei Bardellini Winery, Italy",,
"Terre da Vino Winery, Italy",,
"Edward Sellers Winery, US",,
"Avenue Winery, Argentina",,
"Callia Winery, Argentina",,
"Mallea Winery, US",,
"Occhipinti Winery, Italy",,
"Blue Farm Winery, US",,
"Kissos Winery, US",,
"Domaine du Chalet Pouilly Winery, France",,
"Bodegas Caro Winery, Argentina",,
"The Mountain Winery, US",,
"Gauchezco Winery, Argentina",,
"Colli di Castelfranci Winery, Italy",,
"Crushed Winery, US",,
"Cuvée Wine Cellars Winery, US",,
"Domaine Antonin Guyon Winery, France",,
"Pere Ventura Winery, Spain",,
"Sorrentino Winery, Italy",,
"Tommasone Winery, Italy",,
"Viridiana Winery, Spain",,
"Élevée Winegrowers Winery, US",,
"Pellet Estate Winery, US",,
"Richard Rottiers Winery, France",,
"Zusslin Winery, France",,
"Arcudi Winery, US",,
"Barbieri Winery, US",,
"Quinta da Calçada Winery, Portugal",,
"SonVida Winery, Argentina",,
"Hacormim Winery, Israel",,
"Moccagatta Winery, Italy",,
"Orgo Winery, Georgia",,
"Quimay Winery, Argentina",,
"Raineri Gianmatteo Winery, Italy",,
"Renzo Seghesio Winery, Italy",,
"Rivetti Massimo Winery, Italy",,
"Schuchmann Wines, Georgia",,
"Shumi Winery, Georgia",,
"St. Donat Winery, ",,
"The Divining Rod Winery, US",,
"Legendre Winery, US",,
"Malk Winery, US",,
"Le Marognole Winery, Italy",,
"François Lurton Winery, France",,
"Begali Winery, Italy",,
"Brady Family Winery, US",,
"Trapezio Winery, Argentina",,
"VinRoc Winery, US",,
"Tall Poppy Winery, Australia",,
"Bodegas Copaboca Winery, Spain",,
"Spotted Owl Winery, US",,
"Santa Florentina Winery, Argentina",,
"Château Bonnet Winery, France",,
"Veramonte Winery, Chile",,
"Neyen Winery, Chile",,
"Quinta do Perdigão Winery, Portugal",,
"Sabotage Winery, US",,
"Syrahmi Winery, Australia",,
"Azelia Winery, Italy",,
"Chalone Winery, US",,
"Château Beychevelle Winery, France",,
"Clos Haut-Peyraguey Winery, France",,
"Château Chauvin Winery, France",,
"Château Cône-Taillasson Sabourin Winery, France",,
"Château des Landes Winery, France",,
"Château Les Grands Maréchaux Winery, France",,
"Château L'Escadre Winery, France",,
"Château Moulin de Guiet Winery, France",,
"Vestini Campagnano Winery, Italy",,
"Vins El Cep Winery, Spain",,
"Domaine Dominique Gruhier Winery, France",,
"Girly Girl Winery, US",,
"Montevetrano Winery, Italy",,
"Fattoria Lavacchio Winery, Italy",,
"Flocchini Winery, US",,
"Aje Winery, US",,
"Alexander Winery, Israel",,
"Altadonna Winery, Italy",,
"Bernard Magrez Winery, Morocco",,
"L'Antica Fornace di Ridolfo Winery, Italy",,
"Robert Gilliard Winery, Switzerland",,
"Roxanich Winery, Croatia",,
"Sarotto Winery, Italy",,
"Stemmler Winery, US",,
"Tenuta L'Illuminata Winery, Italy",,
"Alma Sol Winery, US",,
"Bera Winery, Italy",,
"Gianelli Winery, US",,
"Mas du Fadan Winery, France",,
"Plumb Cellars Winery, US",,
"Temps de Flors Winery, Spain",,
"Txomín Etxaníz Winery, Spain",,
"Valtea Winery, Spain",,
"Santa Monica Winery, Chile",,
"Château Maison Blanche Winery, France",,
"Château Thénac Winery, France",,
"Epilogue Winery, US",,
"Fiddletown Cellars Winery, US",,
"Les Parcelles de Stéphane Derenoncourt Winery, France",,
"Mesa Winery, Italy",,
"Pepi Winery, US",,
"San Nicolas Winery, Chile",,
"Stinson Winery, US",,
"Huntington Winery, US",,
"Château Tour Prignac Winery, France",,
"Con Carne Winery, Chile",,
"Poderi Angelini Winery, Italy",,
"Château Cantinot Winery, France",,
"Château Saint-Sulpice Winery, France",,
"Homage Winery, US",,
"Tritano Winery, Italy",,
"Edmond August Winery, US",,
"Fernández Gómez Winery, Spain",,
"Maison Sichel Winery, France",,
"Bocale Winery, Italy",,
"Château Vieux Robin Winery, France",,
"Contucci Winery, Italy",,
"Tenuta Sette Cieli Winery, Italy",,
"Domaine Vincent Stoeffler Winery, France",,
"Aberrant Cellars Winery, US",,
"Namasté Vineyards, US",,
"Finnegan's Lake Winery, US",,
"Rubicon Estate Winery, US",,
"Kaesler Winery, Australia",,
"Quinta da Lixa Winery, Portugal",,
"Quinta da Raza Winery, Portugal",,
"Ribbon Cliff Winery, US",,
"Sola Winery, US",,
"Sweetzer Cellars Winery, US",,
"Vie di Romans Winery, Italy",,
"Villa Yustina Winery, Bulgaria",,
"Budureasca Winery, Romania",,
"Finca Patagonia Winery, Chile",,
"Sharecropper's Winery, US",,
"Martha Clara Winery, US",,
"Red Tail Ridge Winery, US",,
"Round Hill Winery, US",,
"Bautista Simona Winery, Argentina",,
"Château Cahuzac Winery, France",,
"Duchessa Lia Winery, Italy",,
"Pelvillain Frères Winery, France",,
"True Myth Winery, US",,
"UDACA Winery, Portugal",,
"Virginia Dare Winery, US",,
"Montalvo Wilmot Winery, Spain",,
"Marcolino Sebo Winery, Portugal",,
"Larner Winery, US",,
"Monte Branco Winery, Portugal",,
"Jean-Maurice Raffault Winery, France",,
"Château Gaudrelle Winery, France",,
"Couly-Dutheil Winery, France",,
"Domaine des Berthiers Winery, France",,
"Viña La Rosa Winery, Chile",,
"Vodopivec Winery, Italy",,
"Poggio Bonelli Winery, Italy",,
"Stephen Vincent Winery, US",,
"Acre Twenty-one Winery, US",,
"Artimino Winery, Italy",,
"Goose Ridge Winery, US",,
"Château des Antonins Winery, France",,
"Château Haut Vieux Chêne Winery, France",,
"Château Jean de Bel Air Winery, France",,
"Château Ramage la Batisse Winery, France",,
"Château Grand Jean Winery, France",,
"Conde Bel Winery, Spain",,
"Esser Winery, US",,
"Hudson Shah Winery, US",,
"Château Taussin Winery, France",,
"Putah Creek Winery, US",,
"Sexual Chocolate Winery, US",,
"Koehler Winery, US",,
"La Val Winery, Spain",,
"Viña Aquitania Winery, Chile",,
"Yaffo Winery, Israel",,
"Domaine Vico Winery, France",,
"Two Horns Winery, US",,
"Öko Winery, Argentina",,
"Adega Mayor Winery, Portugal",,
"Cuckoo's Nest Winery, US",,
"Domaine Paquet et Fils Winery, France",,
"ZinPhomaniac Winery, US",,
"Domaine Saumaize-Michelin Winery, France",,
"Gaia Wines, Greece",,
"Hibou Winery, US",,
"McKinney Winery, US",,
"Château Fonfroide Winery, France",,
"Domaine Saint-Rémy Winery, France",,
"Legacy Winery, US",,
"Château la Tour Blanche Winery, France",,
"Neudorf Winery, New Zealand",,
"Kelby James Russell Winery, US",,
"Luiano Winery, Italy",,
"Pennywise Winery, US",,
"Staete Landt Winery, New Zealand",,
"Terre d'Aleramo Winery, Italy",,
"IL Gioiello Winery, US",,
"Ca' dei Mandorli Winery, Italy",,
"Dogliotti 1870 Winery, Italy",,
"Gancia Winery, Italy",,
"Petaluma Winery, Australia",,
"Château Rouget Winery, France",,
"Château Sérilhan Winery, France",,
"Clos l'Eglise Winery, France",,
"Domaine du Pegau Winery, France",,
"Vignerons de Caractère Winery, France",,
"Château la Bienfaisance Winery, France",,
"Château Lascombes Winery, France",,
"Château Paloumey Winery, France",,
"Weingut Albert Gessinger Winery, Germany",,
"WillowBrook Cellars Winery, US",,
"Donato D'Angelo Winery, Italy",,
"Gérard Loriot Winery, France",,
"J. Bäumer Winery, Germany",,
"San Marcos Creek Winery, US",,
"Aurora Cellars Winery, Brazil",,
"Backhouse Winery, US",,
"Bodegas y Viñedos Noe Winery, Spain",,
"Greedy Winery, US",,
"DSG Vineyards, Spain",,
"Jettlynn Winery, US",,
"Lidio Carraro Winery, Brazil",,
"Borgo San Daniele Winery, Italy",,
"Dilao Winery, Georgia",,
"Quinta das Marias Winery, Portugal",,
"Seufert Winery, US",,
"Teliani Valley Winery, Georgia",,
"Vinkara Winery, Turkey",,
"Colcanyon Winery, US",,
"Dolin Winery, US",,
"Domaine Netofa Winery, Israel",,
"Hilt & Blade Winery, US",,
"Tenuta Buon Tempo Winery, Italy",,
"Teperberg Winery, Israel",,
"Peñalolen Winery, Chile",,
"Ahnfeldt Winery, US",,
"Calcareous Winery, US",,
"Les Vignerons de la Méditerranée Winery, France",,
"Rockroom Winemaking Cooperative Winery, US",,
"Coastview Winery, US",,
"Cumbre of Vine Hill Winery, US",,
"Château de Jurque Winery, France",,
"Château Labastidié Winery, France",,
"Domaine Berrod Winery, France",,
"Fall Line Winery, US",,
"Mirabelle Winery, US",,
"Nemeion Estate Winery, Greece",,
"Purple Star Winery, US",,
"Jean-Michel Dupré Winery, France",,
"Kourtaki Winery, Greece",,
"Underground Wine Project Winery, US",,
"Martín Berdugo Winery, Spain",,
"Wiegner Winery, Italy",,
"Jack Creek Winery, US",,
"Karl Josef Winery, Germany",,
"Tascante Winery, Italy",,
"Le Charmel Winery, France",,
"Masseria Altemura Winery, Italy",,
"Mussel Bay Winery, New Zealand",,
"Perla del Garda Winery, Italy",,
"Rippon Winery, New Zealand",,
"Eradus Winery, New Zealand",,
"Filippi Winery, Italy",,
"Echo Bay Winery, New Zealand",,
"Prime Solum Winery, US",,
"Quilt Winery, US",,
"Bodegas Paso Robles Winery, US",,
"Brokenwood Winery, Australia",,
"Hauck Winery, US",,
"Fongaro Winery, Italy",,
"Viña El Cerno Winery, Argentina",,
"Murphy's Law Winery, US",,
"St Hallett Winery, Australia",,
"Rooiberg Winery, South Africa",,
"Sea Mist Winery, US",,
"Angelo Cellars Winery, US",,
"Ankal Winery, Spain",,
"Carlson Winery, US",,
"Château la Mascaronne Winery, France",,
"Château Sainte-Béatrice Winery, France",,
"Domaine Capmartin Winery, France",,
"Domaine Dragon Winery, France",,
"Château Philippe-le-Hardi Winery, France",,
"Crossfork Creek Winery, US",,
"Il Roverone Winery, Italy",,
"Nathalie et Gilles Fèvre Winery, France",,
"Open Range Winery, US",,
"Secondo Marco Winery, Italy",,
"Domaine Amirault Winery, France",,
"Domaine Roger & Christophe Moreux Winery, France",,
"Véronique Günther-Chereau Winery, France",,
"Sera Fina Winery, US",,
"Staatliche Weinbaudomäne Oppenheim Winery, Germany",,
"Tanner Winery, US",,
"VGS Chateau Potelle Winery, US",,
"Quanta Terra Winery, Portugal",,
"Château de Lancyre Winery, France",,
"Domaine du Prince Winery, France",,
"Fontes & Phillips Winery, US",,
"Altas Quintas Winery, Portugal",,
"Cantine Cipressi Winery, Italy",,
"Ferraud et Fils Winery, France",,
"HKG Winery, US",,
"Signaterra Winery, US",,
"Sinclair Estate Vineyards, US",,
"Coto de Gomariz Winery, Spain",,
"Diemersfontein Winery, South Africa",,
"De Coelo Winery, US",,
"Domaine de Billards Winery, France",,
"Gaël Martin Winery, France",,
"Tres Valles Winery, Mexico",,
"Venturini Baldini Winery, Italy",,
"Greg Norman Estates Winery, US",,
"Santero Winery, Italy",,
"Cantina di Puianello Winery, Italy",,
"Enza Winery, Italy",,
"Trinitas Winery, US",,
"Unión de Productores del Valle (UPVG) Winery, Mexico",,
"Charles Orban Winery, France",,
"Zefina Winery, US",,
"Tsillan Cellars Winery, US",,
"Aurum Winery, New Zealand",,
"Pellegrini Winery, US",,
"Side Job Winery, US",,
"Cru Vin Dogs Winery, US",,
"Delbeck Winery, France",,
"Fromm Winery, New Zealand",,
"Antonio Caggiano Winery, Italy",,
"Charlier & Fils Winery, France",,
"Fattoria Ambra Winery, Italy",,
"Karl Schaefer Winery, Germany",,
"Valentin Leflaive Winery, France",,
"Dominio Basconcillos Winery, Spain",,
"Patel Winery, US",,
"Tenuta Le Calcinaie Winery, Italy",,
"Estate 1856 Winery, US",,
"Villa Sparina Winery, Italy",,
"Loma Prieta Winery, US",,
"Mony Winery, Israel",,
"Pascal Jolivet Winery, France",,
"Forti del Vento Winery, Italy",,
"Château Plaisance Winery, France",,
"Castello dei Rampolla Winery, Italy",,
"Clos de la Tech Winery, US",,
"Spottswoode Winery, US",,
"Il Colle Winery, Italy",,
"Langmeil Winery, Australia",,
"Matthias Müller Winery, Germany",,
"Scriani Winery, Italy",,
"Finca Torremilanos Winery, Spain",,
"Lorca Winery, Spain",,
"Ackerman Winery, US",,
"Boxwood Winery, US",,
"Colinas do Douro Winery, Portugal",,
"Dehlinger Winery, US",,
"Charles-Gilbert de Vindé Winery, France",,
"Harper Voit Winery, US",,
"Michaud Winery, US",,
"Monte da Capela Winery, Portugal",,
"Pulchella Winery, US",,
"Müller-Grossmann Winery, Austria",,
"Sidebar Winery, US",,
"Foxes Island Winery, New Zealand",,
"Liana Estates Winery, US",,
"Domaine Ellevin Winery, France",,
"Dominio IV Winery, US",,
"Croft Winery, Portugal",,
"Masari Winery, Italy",,
"Diamond Ridge Vineyards, US",,
"Riebeek Cellars Winery, South Africa",,
"Bodegas Aragonesas Winery, Spain",,
"Château Cadillac Winery, France",,
"Duca del Frassino Winery, Italy",,
"Durbanville Hills Winery, South Africa",,
"HammerSky Winery, US",,
"Suncé Vineyard & Winery, US",,
"Grand Bourgeau Winery, France",,
"Louis Bouillot Winery, France",France,"[46.227638, 2.213749]"
"Hensteeth Winery, US",,
"Kristodd Winery, US",,
"Altamana Winery, Chile",Chile,"[-35.675147, -71.542969]"
"Tierras Guindas Winery, Spain",Spain,"[40.46366700000001, -3.74922]"
"Château Hourtin-Ducasse Winery, France","Route de la Chatole Lieu-dit, 33250 Saint-Sauveur, France","[45.1915683, -0.8002904]"
"Carucci Winery, US",,
"Fontes da Cunha Winery, Portugal",Portugal,"[39.39987199999999, -8.224454]"
"Ritual Winery, Chile",Chile,"[-35.675147, -71.542969]"
"Vaza Winery, Spain",Spain,"[40.46366700000001, -3.74922]"
"Valle Pradinhos Winery, Portugal",Portugal,"[39.39987199999999, -8.224454]"
"oops Winery, Chile",Chile,"[-35.675147, -71.542969]"
"Weatherborne Winery, US",,
"San Elias Winery, Chile",Chile,"[-35.675147, -71.542969]"
"Chono Winery, Chile",Chile,"[-35.675147, -71.542969]"
"Big House Winery, US",United States,"[37.09024, -95.712891]"
"Calcu Winery, Chile",Chile,"[-35.675147, -71.542969]"
"Davis Bynum Winery, US",United States,"[37.09024, -95.712891]"
"Monte Clavijo Winery, Spain","26130 Clavijo, La Rioja, Spain","[42.347961, -2.42643]"
"Bread & Butter Winery, US",,
"Back Seat Winery, US",,
"Ranchero Cellars Winery, US","1140 Pine St, Paso Robles, CA 93446, USA","[35.6265484, -120.688506]"
"Flywheel Winery, US",,
"Zeal Winery, New Zealand",New Zealand,"[-40.900557, 174.885971]"
"Christine Andrew Winery, US",,
"Gunn Estate Winery, New Zealand",New Zealand,"[-40.900557, 174.885971]"
"Tsililis Winery, ",,
"Liparita Winery, US",,
"Wallis Family Estate Winery, US",United States,"[37.09024, -95.712891]"
"Petrelli Winery, Italy",Italy,"[41.87194, 12.56738]"
"J. & F. Lurton Winery, Portugal","Vila Santa s/n, 7100-149 Estremoz, Portugal","[38.8402416, -7.628929299999999]"
"1912 Winemakers Winery, Portugal",Portugal,"[39.39987199999999, -8.224454]"
"Adler Fels Winery, US",,
"Kurt Hain Winery, Germany",Germany,"[51.165691, 10.451526]"
"Sensorium Winery, US",,
"Hervé Kerlann Winery, France",France,"[46.227638, 2.213749]"
"Trenza Winery, US","5828 Orcutt Rd, San Luis Obispo, CA 93401, USA","[35.2273273, -120.5997102]"
"Domaine Laleure-Piot Winery, France","5 Rue du Grenier À Sel, 21200 Beaune, France","[47.02479109999999, 4.8406664]"
"Léon Perdigal Winery, France",France,"[46.227638, 2.213749]"
"Painted Wolf Winery, South Africa",South Africa,"[-30.559482, 22.937506]"
"Jean Biecher & Fils Winery, France","1 Route de Rodern, 68590 Saint-Hippolyte, France","[48.21975219999999, 7.3959377]"
"Nicholas Cole Cellars Winery, US",,
"McDermaid Winery, US",,
"Andean Winery, Argentina","Tunuyán, Mendoza Province, Argentina","[-33.6663341, -69.2225746]"
"Vin Vault Winery, US",,
"Zoetic Wines, US",,
"Dachshund Winery, Germany",Germany,"[51.165691, 10.451526]"
"Jules Taylor Winery, New Zealand",New Zealand,"[-40.900557, 174.885971]"
"Pingao Winery, Spain",Spain,"[40.46366700000001, -3.74922]"
"Sun Garden Winery, Germany",Germany,"[51.165691, 10.451526]"
"Raymond Beck Winery, France",France,"[46.227638, 2.213749]"
"Cristalino Winery, Spain",Spain,"[40.46366700000001, -3.74922]"
"Barefoot Cellars Winery, US","600 Yosemite Blvd, Modesto, CA 95354, USA","[37.6345454, -120.9822801]"
"Thanisch Winery, Germany","Saarallee 31, 54470 Bernkastel-Kues, Germany","[49.9127215, 7.0689598]"
"Christian Leperchois Winery, France",France,"[46.227638, 2.213749]"
"Picos Pardos Winery, Spain",Spain,"[40.46366700000001, -3.74922]"
"Château Béhèré Courtin Winery, France",France,"[46.227638, 2.213749]"
"Finca Jakue Winery, Spain",Spain,"[40.46366700000001, -3.74922]"
"Aspaldi Winery, Spain",Spain,"[40.46366700000001, -3.74922]"
"Château Croix de Mission Winery, France",France,"[46.227638, 2.213749]"
"Bella Bollè Winery, Italy",Italy,"[41.87194, 12.56738]"
"Tierra Prometida Winery, Argentina",Argentina,"[-38.416097, -63.61667199999999]"
"Tango Reàl Winery, Argentina",Argentina,"[-38.416097, -63.61667199999999]"
"Diamond River Winery, South Africa",South Africa,"[-34.3572922, 19.2758311]"
"Recoletas Winery, Spain",Spain,"[40.46366700000001, -3.74922]"
"Rhiannon Winery, US","1680 Silverado Trail S, St Helena, CA 94574, USA","[38.4885429, -122.4071289]"
"Junta Winery, Chile",Chile,"[-35.675147, -71.542969]"
"Mario Perelli-Minetti Winery, US",,
"Cupcake Winery, Argentina",Argentina,"[-38.416097, -63.61667199999999]"
"Expression 39 Winery, US",,
"Bowtie Winery, US","8060 US-190, Rogers, TX 76569, USA","[30.99461, -97.2844397]"
"Château Gabaron Winery, France",France,"[46.227638, 2.213749]"
"Château Vieux Ferrand Winery, France",France,"[46.227638, 2.213749]"
"Sirius Winery, France",France,"[46.227638, 2.213749]"
"Louis Drescher Winery, Spain",Spain,"[40.46366700000001, -3.74922]"
"Nobilissima Winery, Italy",Italy,"[41.87194, 12.56738]"
"Biancariva Winery, Italy",Italy,"[41.87194, 12.56738]"
"Art of Earth Winery, Germany",Germany,"[51.165691, 10.451526]"
"Albert Besombes Winery, France",France,"[46.227638, 2.213749]"
"Amore di Amanti Winery, Italy",Italy,"[41.87194, 12.56738]"
"Mario Gagliasso Winery, Italy",Italy,"[41.87194, 12.56738]"
"Lagar del Rey Winery, Spain",Spain,"[40.46366700000001, -3.74922]"
"Pe're Alessandro Winery, Italy",Italy,"[41.87194, 12.56738]"
"Château Avernus Winery, France","2290 S French Rd, Lake Leelanau, MI 49653, USA","[44.9484416, -85.7551398]"
"Windrun Winery, US",,
"Sedosa Winery, Spain","Calle de la Muela, 16, 03737 Xàbia, Alicante, Spain","[38.7919649, 0.1274321]"
"La Fleur Ribeyrolles Winery, France",France,"[46.227638, 2.213749]"
"Bodkin Winery, US",,
"Finca La Luz Winery, Argentina","Tunuyán, Mendoza Province, Argentina","[-33.5611167, -69.14870189999999]"
"Barros Winery, Portugal",Portugal,"[39.39987199999999, -8.224454]"
"Château de la Jaubertie Winery, France",,
"Florian Roblin Winery, France",France,"[46.227638, 2.213749]"
"Joseph Soggé Winery, US",,
"Merlot-Tannat Winery, France",France,"[46.227638, 2.213749]"
"Tyler Florence Winery, US",United States,"[37.09024, -95.712891]"
"Martha's Wines, Portugal",Portugal,"[39.39987199999999, -8.224454]"
"Michel Lynch Winery, France",France,"[46.227638, 2.213749]"
"Seña Winery, Chile",Chile,"[-35.675147, -71.542969]"
"Tom Gore Winery, US",United States,"[37.09024, -95.712891]"
"Domaine de Vaugondy Winery, France",France,"[46.227638, 2.213749]"
"Clos d'Audhuy Winery, France",France,"[46.227638, 2.213749]"
"Scroll Winery, US",,
"Tenute dei Vallarino Winery, Italy",Italy,"[41.87194, 12.56738]"
"El Pensador Winery, Spain",Spain,"[40.46366700000001, -3.74922]"
"Barão de Vilar Winery, Portugal",Portugal,"[39.39987199999999, -8.224454]"
"Apsara Winery, US",,
"Castel Boglione Winery, Italy","2 Viale Pietro Laudano, Castel Boglione, At 14040, Italy","[44.7207254, 8.383769899999999]"
"Château du Seguinier Winery, France","2290 S French Rd, Lake Leelanau, MI 49653, USA","[44.9484416, -85.7551398]"
"Château Jussas Winery, France","33250 Pauillac, France","[45.2249531, -0.7724358]"
"Château Les Martins Winery, France",France,"[46.227638, 2.213749]"
"Château Rocher Bellevue Winery, France",France,"[46.227638, 2.213749]"
"Anko Winery, Argentina",Argentina,"[-38.416097, -63.61667199999999]"
"Insatiable Winery, US",,
"Espectacle Winery, Spain",Spain,"[40.46366700000001, -3.74922]"
"Château Fonsèche Winery, France","LD La Garrigue, 24240 Saussignac, France","[44.80656399999999, 0.328731]"
"Château Joinin Winery, France","LD La Garrigue, 24240 Saussignac, France","[44.80656399999999, 0.328731]"
"Fortress Winery, US","12615 US-52, Dubuque, IA 52002, USA","[42.5616312, -90.732801]"
"Little Giant Winery, US",,
"Bernard Magrez Winery, Spain",Spain,"[40.46366700000001, -3.74922]"
"BonAnno Winery, US","1090 US-206, Shamong, NJ 08088, USA","[39.791358, -74.73673699999999]"
"db Winery, US","10352 E US Highway 290, Hye, TX 78635, United States","[30.242681, -98.57238199999999]"
"Domaine Champy Winery, France","5 Rue du Grenier À Sel, 21200 Beaune, France","[47.024716, 4.84085]"
"Viña Tabalí Winery, Chile","990 NW Brooks St, Bend, OR 97701, USA","[44.0596817, -121.3139235]"
"Ermisch Winery, US",United States,"[37.09024, -95.712891]"
"Francesc Sanchez Bas Winery, Spain",Spain,"[40.46366700000001, -3.74922]"
"Clunia Winery, Spain",Spain,"[40.46366700000001, -3.74922]"
"Prima Mazzo Winery, Italy",Italy,"[41.87194, 12.56738]"
"Terra Silvestre Winery, Portugal",Portugal,"[39.39987199999999, -8.224454]"
"Nico Winery, US","10352 E US Highway 290, Hye, TX 78635, United States","[30.242681, -98.57238199999999]"
"Santa Isle Winery, Chile",Chile,"[-35.675147, -71.542969]"
"Comoloco Winery, Spain",Spain,"[40.46366700000001, -3.74922]"
"Prieuré de Montézargues Winery, France",France,"[46.227638, 2.213749]"
"Weingut Niklas Winery, Italy",Italy,"[41.87194, 12.56738]"
"Marcarini Winery, Italy",,
"Mirus Winery, Italy","Contrada via Case Sparse, 73015 Salice Salentino LE, Italy","[40.3898762, 17.8777131]"
"Newhouse Family Winery, US","1090 US-206, Shamong, NJ 08088, USA","[39.791358, -74.73673699999999]"
